,CAND_ID,CAND_NAME,CAND_PTY_AFFILIATION,CAND_OFFICE_ST,CAND_OFFICE_DISTRICT,CAND_ICI,ELECT_TYPE,STATE_FULL,CAND_PTY_AFFILIATION_FULL,search_query,campaign_results_list
1031,H0IL11128,"BANSAL, KRISHNA K",REP,IL,11,Challenger,House,Illinois,Republican,"BANSAL, KRISHNA K Republican Illinois House","BANSAL, KRISHNA K Republican Illinois House 2021"
1032,H4IL11229,"ROBBINS, CRAIG",REP,IL,11,Challenger,House,Illinois,Republican,"ROBBINS, CRAIG Republican Illinois House","ROBBINS, CRAIG Republican Illinois House 2021"
1033,H6IL11117,"KHOURI, TONIA",REP,IL,11,Challenger,House,Illinois,Republican,"KHOURI, TONIA Republican Illinois House","KHOURI, TONIA Republican Illinois House 2021"
1034,H6IL11133,"STELLA, DOMINICK J. M.D.",REP,IL,11,Challenger,House,Illinois,Republican,"STELLA, DOMINICK J. M.D. Republican Illinois House","STELLA, DOMINICK J. M.D. Republican Illinois House 2021"
1035,H0IL12092,"FUNK, JOEL DAVID",DEM,IL,12,Challenger,House,Illinois,Democrat,"FUNK, JOEL DAVID Democrat Illinois House","FUNK, JOEL DAVID Democrat Illinois House 2021"
1036,H0IL12100,"LENZI, RAYMOND CARL DR.",DEM,IL,12,Challenger,House,Illinois,Democrat,"LENZI, RAYMOND CARL DR. Democrat Illinois House","LENZI, RAYMOND CARL DR. Democrat Illinois House 2021"
1037,H6IL12099,"BARICEVIC, CHARLES JOHN",DEM,IL,12,Challenger,House,Illinois,Democrat,"BARICEVIC, CHARLES JOHN Democrat Illinois House","BARICEVIC, CHARLES JOHN Democrat Illinois House 2021"
1038,H8IL12129,"KELLY, BRENDAN",DEM,IL,12,Challenger,House,Illinois,Democrat,"KELLY, BRENDAN Democrat Illinois House","KELLY, BRENDAN Democrat Illinois House 2021"
1039,H8IL21021,"COSTELLO, JERRY F",DEM,IL,12,Challenger,House,Illinois,Democrat,"COSTELLO, JERRY F Democrat Illinois House","COSTELLO, JERRY F Democrat Illinois House 2021"
1040,H4IL12060,"BOST, MICHAEL",REP,IL,12,Incumbent,House,Illinois,Republican,"BOST, MICHAEL Republican Illinois House","BOST, MICHAEL Republican Illinois House 2021"
1041,H0IL13066,"SMITH, STEFANIE",DEM,IL,13,Challenger,House,Illinois,Democrat,"SMITH, STEFANIE Democrat Illinois House","SMITH, STEFANIE Democrat Illinois House 2021"
1042,H8IL13150,"LONDRIGAN, BETSY DIRKSEN",DEM,IL,13,Challenger,House,Illinois,Democrat,"LONDRIGAN, BETSY DIRKSEN Democrat Illinois House","LONDRIGAN, BETSY DIRKSEN Democrat Illinois House 2021"
1043,H2IL13120,"DAVIS, RODNEY L",REP,IL,13,Incumbent,House,Illinois,Republican,"DAVIS, RODNEY L Republican Illinois House","DAVIS, RODNEY L Republican Illinois House 2021"
1044,H8IL14166,"BROLLEY, MATT",DEM,IL,14,Challenger,House,Illinois,Democrat,"BROLLEY, MATT Democrat Illinois House","BROLLEY, MATT Democrat Illinois House 2021"
1045,H8IL14174,"UNDERWOOD, LAUREN",DEM,IL,14,Incumbent,House,Illinois,Democrat,"UNDERWOOD, LAUREN Democrat Illinois House","UNDERWOOD, LAUREN Democrat Illinois House 2021"
1046,H0IL14080,"HULTGREN, RANDY",REP,IL,14,Incumbent,House,Illinois,Republican,"HULTGREN, RANDY Republican Illinois House","HULTGREN, RANDY Republican Illinois House 2021"
1047,H0IL14148,"QUIGLEY, MATTHEW MARK MR.",REP,IL,14,Challenger,House,Illinois,Republican,"QUIGLEY, MATTHEW MARK MR. Republican Illinois House","QUIGLEY, MATTHEW MARK MR. Republican Illinois House 2021"
1048,H0IL14155,"MALOUF, DANIEL",REP,IL,14,Challenger,House,Illinois,Republican,"MALOUF, DANIEL Republican Illinois House","MALOUF, DANIEL Republican Illinois House 2021"
1049,H0IL14163,"GRADEL, TED",REP,IL,14,Challenger,House,Illinois,Republican,"GRADEL, TED Republican Illinois House","GRADEL, TED Republican Illinois House 2021"
1050,H0IL14189,"REZIN, SUE",REP,IL,14,Challenger,House,Illinois,Republican,"REZIN, SUE Republican Illinois House","REZIN, SUE Republican Illinois House 2021"
1051,H0IL14197,"LAUF, CATALINA",REP,IL,14,Challenger,House,Illinois,Republican,"LAUF, CATALINA Republican Illinois House","LAUF, CATALINA Republican Illinois House 2021"
1052,H0IL14205,"CATELLA, ANTHONY",REP,IL,14,Challenger,House,Illinois,Republican,"CATELLA, ANTHONY Republican Illinois House","CATELLA, ANTHONY Republican Illinois House 2021"
1053,H0IL14213,"EVANS, JERRY",REP,IL,14,Challenger,House,Illinois,Republican,"EVANS, JERRY Republican Illinois House","EVANS, JERRY Republican Illinois House 2021"
1054,H8IL14075,"LAUZEN, CHRIS",REP,IL,14,Open seat,House,Illinois,Republican,"LAUZEN, CHRIS Republican Illinois House","LAUZEN, CHRIS Republican Illinois House 2021"
1055,H8IL14083,"OBERWEIS, JIM",REP,IL,14,Challenger,House,Illinois,Republican,"OBERWEIS, JIM Republican Illinois House","OBERWEIS, JIM Republican Illinois House 2021"
1056,H8IL16153,"MARTER, JAMES THOMAS",REP,IL,14,Challenger,House,Illinois,Republican,"MARTER, JAMES THOMAS Republican Illinois House","MARTER, JAMES THOMAS Republican Illinois House 2021"
1057,H0IL15194,"WEAVER, ERIKA C",DEM,IL,15,Open seat,House,Illinois,Democrat,"WEAVER, ERIKA C Democrat Illinois House","WEAVER, ERIKA C Democrat Illinois House 2021"
1058,H0IL15210,"MORTON, CRAIG",DEM,IL,15,Open seat,House,Illinois,Democrat,"MORTON, CRAIG Democrat Illinois House","MORTON, CRAIG Democrat Illinois House 2021"
1059,H8IL15072,"GAITHER, KEVIN",DEM,IL,15,Open seat,House,Illinois,Democrat,"GAITHER, KEVIN Democrat Illinois House","GAITHER, KEVIN Democrat Illinois House 2021"
1060,H0IL15129,"MILLER, MARY",REP,IL,15,Open seat,House,Illinois,Republican,"MILLER, MARY Republican Illinois House","MILLER, MARY Republican Illinois House 2021"
1061,H0IL15137,"BAMBENEK, JOHN CHRISTIAN",REP,IL,15,Open seat,House,Illinois,Republican,"BAMBENEK, JOHN CHRISTIAN Republican Illinois House","BAMBENEK, JOHN CHRISTIAN Republican Illinois House 2021"
1062,H0IL15145,"WOLFF, KERRY ALLEN",REP,IL,15,Open seat,House,Illinois,Republican,"WOLFF, KERRY ALLEN Republican Illinois House","WOLFF, KERRY ALLEN Republican Illinois House 2021"
1063,H0IL15186,"DUNCAN, DARREN",REP,IL,15,Open seat,House,Illinois,Republican,"DUNCAN, DARREN Republican Illinois House","DUNCAN, DARREN Republican Illinois House 2021"
1064,H0IL15202,"ELLINGTON, CHARLES RICHARD DR. JR.",REP,IL,15,Open seat,House,Illinois,Republican,"ELLINGTON, CHARLES RICHARD DR. JR. Republican Illinois House","ELLINGTON, CHARLES RICHARD DR. JR. Republican Illinois House 2021"
1065,H2IL20042,"SHIMKUS, JOHN M",REP,IL,15,Incumbent,House,Illinois,Republican,"SHIMKUS, JOHN M Republican Illinois House","SHIMKUS, JOHN M Republican Illinois House 2021"
1066,H6IL15084,"MCCARTER, KYLE",REP,IL,15,Challenger,House,Illinois,Republican,"MCCARTER, KYLE Republican Illinois House","MCCARTER, KYLE Republican Illinois House 2021"
1067,H0IL16184,"BRZOZOWSKI, DANI",DEM,IL,16,Challenger,House,Illinois,Democrat,"BRZOZOWSKI, DANI Democrat Illinois House","BRZOZOWSKI, DANI Democrat Illinois House 2021"
1068,H8IL16096,"MOHAMMAD, NEILL DR.",DEM,IL,16,Challenger,House,Illinois,Democrat,"MOHAMMAD, NEILL DR. Democrat Illinois House","MOHAMMAD, NEILL DR. Democrat Illinois House 2021"
1069,H8IL16120,"DADY, SARA",DEM,IL,16,Challenger,House,Illinois,Democrat,"DADY, SARA Democrat Illinois House","DADY, SARA Democrat Illinois House 2021"
1070,H0IL11052,"KINZINGER, ADAM",REP,IL,16,Incumbent,House,Illinois,Republican,"KINZINGER, ADAM Republican Illinois House","KINZINGER, ADAM Republican Illinois House 2021"
1071,H2IL17071,"BUSTOS, CHERI",DEM,IL,17,Incumbent,House,Illinois,Democrat,"BUSTOS, CHERI Democrat Illinois House","BUSTOS, CHERI Democrat Illinois House 2021"
1072,H0IL17083,"KING, ESTHER JOY",REP,IL,17,Challenger,House,Illinois,Republican,"KING, ESTHER JOY Republican Illinois House","KING, ESTHER JOY Republican Illinois House 2021"
1073,H4IL17077,"FAWELL, WILLIAM W",REP,IL,17,Challenger,House,Illinois,Republican,"FAWELL, WILLIAM W Republican Illinois House","FAWELL, WILLIAM W Republican Illinois House 2021"
1074,H0IL18065,"HAASIS, MARK",DEM,IL,18,Challenger,House,Illinois,Democrat,"HAASIS, MARK Democrat Illinois House","HAASIS, MARK Democrat Illinois House 2021"
1075,H6IL18161,"RODRIGUEZ, JUNIUS",DEM,IL,18,Challenger,House,Illinois,Democrat,"RODRIGUEZ, JUNIUS Democrat Illinois House","RODRIGUEZ, JUNIUS Democrat Illinois House 2021"
1076,H8IL18092,"DETERS, BRIAN",DEM,IL,18,Challenger,House,Illinois,Democrat,"DETERS, BRIAN Democrat Illinois House","DETERS, BRIAN Democrat Illinois House 2021"
1077,H6IL18088,"LAHOOD, DARIN MCKAY",REP,IL,18,Incumbent,House,Illinois,Republican,"LAHOOD, DARIN MCKAY Republican Illinois House","LAHOOD, DARIN MCKAY Republican Illinois House 2021"
1078,H6IL18138,"RIENTS, DONALD",REP,IL,18,Challenger,House,Illinois,Republican,"RIENTS, DONALD Republican Illinois House","RIENTS, DONALD Republican Illinois House 2021"
1079,H8IL18043,"SCHOCK, AARON JON MR.",REP,IL,18,Incumbent,House,Illinois,Republican,"SCHOCK, AARON JON MR. Republican Illinois House","SCHOCK, AARON JON MR. Republican Illinois House 2021"
1080,H0IN01135,"MCDERMOTT, THOMAS M JR",DEM,IN,1,Open seat,House,Indiana,Democrat,"MCDERMOTT, THOMAS M JR Democrat Indiana House","MCDERMOTT, THOMAS M JR Democrat Indiana House 2021"
1081,H0IN01143,"HARPER, JAMES",DEM,IN,1,Open seat,House,Indiana,Democrat,"HARPER, JAMES Democrat Indiana House","HARPER, JAMES Democrat Indiana House 2021"
1082,H0IN01150,"MRVAN, FRANK J.",DEM,IN,1,Open seat,House,Indiana,Democrat,"MRVAN, FRANK J. Democrat Indiana House","MRVAN, FRANK J. Democrat Indiana House 2021"
1083,H0IN01168,"REARDON, MARA",DEM,IN,1,Open seat,House,Indiana,Democrat,"REARDON, MARA Democrat Indiana House","REARDON, MARA Democrat Indiana House 2021"
1084,H0IN01184,"HAAKE, SABRINA",DEM,IN,1,Open seat,House,Indiana,Democrat,"HAAKE, SABRINA Democrat Indiana House","HAAKE, SABRINA Democrat Indiana House 2021"
1085,H0IN01200,"BOROM, MELISSA",DEM,IN,1,Open seat,House,Indiana,Democrat,"BOROM, MELISSA Democrat Indiana House","BOROM, MELISSA Democrat Indiana House 2021"
1086,H0IN01267,"COSTELLO, SCOTT L MR",DEM,IN,1,Open seat,House,Indiana,Democrat,"COSTELLO, SCOTT L MR Democrat Indiana House","COSTELLO, SCOTT L MR Democrat Indiana House 2021"
1087,H4IN01012,"VISCLOSKY, PETER J.",DEM,IN,1,Incumbent,House,Indiana,Democrat,"VISCLOSKY, PETER J. Democrat Indiana House","VISCLOSKY, PETER J. Democrat Indiana House 2021"
1088,H0IN01218,"SCAIFE, DELANO MICHAEL",REP,IN,1,Open seat,House,Indiana,Republican,"SCAIFE, DELANO MICHAEL Republican Indiana House","SCAIFE, DELANO MICHAEL Republican Indiana House 2021"
1089,H0IN01226,"LEMMONS, SPENCER",REP,IN,1,Open seat,House,Indiana,Republican,"LEMMONS, SPENCER Republican Indiana House","LEMMONS, SPENCER Republican Indiana House 2021"
1090,H0IN01242,"HANDLEY, MONT ANDREW",REP,IN,1,Open seat,House,Indiana,Republican,"HANDLEY, MONT ANDREW Republican Indiana House","HANDLEY, MONT ANDREW Republican Indiana House 2021"
1091,H0IN01333,"LEYVA, MARK J",REP,IN,1,Challenger,House,Indiana,Republican,"LEYVA, MARK J Republican Indiana House","LEYVA, MARK J Republican Indiana House 2021"
1092,H8IN01179,"IVANOVICH, ROSEANN P.",REP,IN,1,Challenger,House,Indiana,Republican,"IVANOVICH, ROSEANN P. Republican Indiana House","IVANOVICH, ROSEANN P. Republican Indiana House 2021"
1093,H0IN02232,"MARKS, ELLEN L.",DEM,IN,2,Challenger,House,Indiana,Democrat,"MARKS, ELLEN L. Democrat Indiana House","MARKS, ELLEN L. Democrat Indiana House 2021"
1094,H6IN02155,"COLEMAN, LYNN CARNELL",DEM,IN,2,Challenger,House,Indiana,Democrat,"COLEMAN, LYNN CARNELL Democrat Indiana House","COLEMAN, LYNN CARNELL Democrat Indiana House 2021"
1095,H8IN02169,"HALL, MEL",DEM,IN,2,Challenger,House,Indiana,Democrat,"HALL, MEL Democrat Indiana House","HALL, MEL Democrat Indiana House 2021"
1096,H8IN02177,"HACKETT, MARY PATRICIA",DEM,IN,2,Challenger,House,Indiana,Democrat,"HACKETT, MARY PATRICIA Democrat Indiana House","HACKETT, MARY PATRICIA Democrat Indiana House 2021"
1097,H0IN02190,"WALORSKI SWIHART, JACKIE",REP,IN,2,Incumbent,House,Indiana,Republican,"WALORSKI SWIHART, JACKIE Republican Indiana House","WALORSKI SWIHART, JACKIE Republican Indiana House 2021"
1098,H8IN02151,"SUMME, MARK JOHN",REP,IN,2,Challenger,House,Indiana,Republican,"SUMME, MARK JOHN Republican Indiana House","SUMME, MARK JOHN Republican Indiana House 2021"
1099,H0IN03230,"COLDIRON, CHIP WINTER MR.",DEM,IN,3,Challenger,House,Indiana,Democrat,"COLDIRON, CHIP WINTER MR. Democrat Indiana House","COLDIRON, CHIP WINTER MR. Democrat Indiana House 2021"
1100,H8IN03076,"TRITCH, COURTNEY",DEM,IN,3,Challenger,House,Indiana,Democrat,"TRITCH, COURTNEY Democrat Indiana House","TRITCH, COURTNEY Democrat Indiana House 2021"
1101,H0IN03222,"MAGIERA, CHRIS",REP,IN,3,Challenger,House,Indiana,Republican,"MAGIERA, CHRIS Republican Indiana House","MAGIERA, CHRIS Republican Indiana House 2021"
1102,H6IN03229,"BANKS, JAMES E HON.",REP,IN,3,Incumbent,House,Indiana,Republican,"BANKS, JAMES E HON. Republican Indiana House","BANKS, JAMES E HON. Republican Indiana House 2021"
1103,H8IN04140,"MACKEY, JOSEPH",DEM,IN,4,Challenger,House,Indiana,Democrat,"MACKEY, JOSEPH Democrat Indiana House","MACKEY, JOSEPH Democrat Indiana House 2021"
1104,H0IN04170,"ROKITA, THEODORE EDWARD",REP,IN,4,Incumbent,House,Indiana,Republican,"ROKITA, THEODORE EDWARD Republican Indiana House","ROKITA, THEODORE EDWARD Republican Indiana House 2021"
1105,H8IN04199,"BAIRD, JAMES R DR.",REP,IN,4,Incumbent,House,Indiana,Republican,"BAIRD, JAMES R DR. Republican Indiana House","BAIRD, JAMES R DR. Republican Indiana House 2021"
1106,H0IN05219,"HALE, CHRISTINA",DEM,IN,5,Open seat,House,Indiana,Democrat,"HALE, CHRISTINA Democrat Indiana House","HALE, CHRISTINA Democrat Indiana House 2021"
1107,H0IN05227,"JACOBS, ANDREW JAMES JR.",DEM,IN,5,Open seat,House,Indiana,Democrat,"JACOBS, ANDREW JAMES JR. Democrat Indiana House","JACOBS, ANDREW JAMES JR. Democrat Indiana House 2021"
1108,H8IN05188,"THORNTON, DIERDRE",DEM,IN,5,Open seat,House,Indiana,Democrat,"THORNTON, DIERDRE Democrat Indiana House","THORNTON, DIERDRE Democrat Indiana House 2021"
1109,H8IN05196,"CHRISTIE, JENNIFER",DEM,IN,5,Open seat,House,Indiana,Democrat,"CHRISTIE, JENNIFER Democrat Indiana House","CHRISTIE, JENNIFER Democrat Indiana House 2021"
1110,H0IN05201,"BECKWITH, MICAH",REP,IN,5,Open seat,House,Indiana,Republican,"BECKWITH, MICAH Republican Indiana House","BECKWITH, MICAH Republican Indiana House 2021"
1111,H0IN05235,"BRAUN, STEVEN J",REP,IN,5,Open seat,House,Indiana,Republican,"BRAUN, STEVEN J Republican Indiana House","BRAUN, STEVEN J Republican Indiana House 2021"
1112,H0IN05243,"MITCHELL, KELLY",REP,IN,5,Open seat,House,Indiana,Republican,"MITCHELL, KELLY Republican Indiana House","MITCHELL, KELLY Republican Indiana House 2021"
1113,H0IN05250,"DIETZEN, CHUCK DR.",REP,IN,5,Open seat,House,Indiana,Republican,"DIETZEN, CHUCK DR. Republican Indiana House","DIETZEN, CHUCK DR. Republican Indiana House 2021"
1114,H0IN05268,"ABERNATHY, KENT",REP,IN,5,Open seat,House,Indiana,Republican,"ABERNATHY, KENT Republican Indiana House","ABERNATHY, KENT Republican Indiana House 2021"
1115,H0IN05276,"HENDERSON, BETH ELAINE",REP,IN,5,Open seat,House,Indiana,Republican,"HENDERSON, BETH ELAINE Republican Indiana House","HENDERSON, BETH ELAINE Republican Indiana House 2021"
1116,H0IN05284,"BALES, ANDREW PETER",REP,IN,5,Open seat,House,Indiana,Republican,"BALES, ANDREW PETER Republican Indiana House","BALES, ANDREW PETER Republican Indiana House 2021"
1117,H0IN05318,"HOOK, MATTHEW CAROLL",REP,IN,5,Open seat,House,Indiana,Republican,"HOOK, MATTHEW CAROLL Republican Indiana House","HOOK, MATTHEW CAROLL Republican Indiana House 2021"
1118,H0IN05326,"SPARTZ, VICTORIA",REP,IN,5,Open seat,House,Indiana,Republican,"SPARTZ, VICTORIA Republican Indiana House","SPARTZ, VICTORIA Republican Indiana House 2021"
1119,H0IN05334,"BRIZZI, CARL JOSEPH",REP,IN,5,Open seat,House,Indiana,Republican,"BRIZZI, CARL JOSEPH Republican Indiana House","BRIZZI, CARL JOSEPH Republican Indiana House 2021"
1120,H2IN05082,"BROOKS, SUSAN MRS.",REP,IN,5,Incumbent,House,Indiana,Republican,"BROOKS, SUSAN MRS. Republican Indiana House","BROOKS, SUSAN MRS. Republican Indiana House 2021"
1121,H2IN06023,"BURTON, DANNY L",REP,IN,5,Challenger,House,Indiana,Republican,"BURTON, DANNY L Republican Indiana House","BURTON, DANNY L Republican Indiana House 2021"
1122,H4IN05112,"DAVIDSON, ALLEN RAY",REP,IN,5,Open seat,House,Indiana,Republican,"DAVIDSON, ALLEN RAY Republican Indiana House","DAVIDSON, ALLEN RAY Republican Indiana House 2021"
1123,H8IN06152,"LAKE, JEANNINE LEE",DEM,IN,6,Challenger,House,Indiana,Democrat,"LAKE, JEANNINE LEE Democrat Indiana House","LAKE, JEANNINE LEE Democrat Indiana House 2021"
1124,H0IN02125,"MESSER, ALLEN LUCAS",REP,IN,6,Incumbent,House,Indiana,Republican,"MESSER, ALLEN LUCAS Republican Indiana House","MESSER, ALLEN LUCAS Republican Indiana House 2021"
1125,H2IN06171,"BATES, DON JR",REP,IN,6,Open seat,House,Indiana,Republican,"BATES, DON JR Republican Indiana House","BATES, DON JR Republican Indiana House 2021"
1126,H8IN06079,"LAMB, JONATHAN M.",REP,IN,6,Open seat,House,Indiana,Republican,"LAMB, JONATHAN M. Republican Indiana House","LAMB, JONATHAN M. Republican Indiana House 2021"
1127,H8IN06129,"PENCE, GREGORY J.",REP,IN,6,Incumbent,House,Indiana,Republican,"PENCE, GREGORY J. Republican Indiana House","PENCE, GREGORY J. Republican Indiana House 2021"
1128,H8IN07176,"ORENTLICHER, DAVID",DEM,IN,7,Open seat,House,Indiana,Democrat,"ORENTLICHER, DAVID Democrat Indiana House","ORENTLICHER, DAVID Democrat Indiana House 2021"
1129,H8IN07184,"CARSON, ANDRE",DEM,IN,7,Incumbent,House,Indiana,Democrat,"CARSON, ANDRE Democrat Indiana House","CARSON, ANDRE Democrat Indiana House 2021"
1130,H0IN07256,"SMITH, SUSAN MARIE",REP,IN,7,Challenger,House,Indiana,Republican,"SMITH, SUSAN MARIE Republican Indiana House","SMITH, SUSAN MARIE Republican Indiana House 2021"
1131,H8IN07150,"HARMON, WAYNE EDWARD",REP,IN,7,Challenger,House,Indiana,Republican,"HARMON, WAYNE EDWARD Republican Indiana House","HARMON, WAYNE EDWARD Republican Indiana House 2021"
1132,H8IN07259,"PING, CATHERINE LOUISE ""CAT""",REP,IN,7,Challenger,House,Indiana,Republican,"PING, CATHERINE LOUISE ""CAT"" Republican Indiana House","PING, CATHERINE LOUISE ""CAT"" Republican Indiana House 2021"
1133,H0IN08213,"MARSILI, THOMASINA",DEM,IN,8,Challenger,House,Indiana,Democrat,"MARSILI, THOMASINA Democrat Indiana House","MARSILI, THOMASINA Democrat Indiana House 2021"
1134,H6IN08244,"DRAKE, RON",DEM,IN,8,Challenger,House,Indiana,Democrat,"DRAKE, RON Democrat Indiana House","DRAKE, RON Democrat Indiana House 2021"
1135,H0IN08114,"BUCSHON, LARRY D.",REP,IN,8,Incumbent,House,Indiana,Republican,"BUCSHON, LARRY D. Republican Indiana House","BUCSHON, LARRY D. Republican Indiana House 2021"
1136,H6IN08228,"MOSS, RICHARD MARC",REP,IN,8,Challenger,House,Indiana,Republican,"MOSS, RICHARD MARC Republican Indiana House","MOSS, RICHARD MARC Republican Indiana House 2021"
1137,H0IN09161,"DORRIS, DALE WILLIAM MR. II",DEM,IN,9,Challenger,House,Indiana,Democrat,"DORRIS, DALE WILLIAM MR. II Democrat Indiana House","DORRIS, DALE WILLIAM MR. II Democrat Indiana House 2021"
1138,H0IN09179,"RUFF, ANDY",DEM,IN,9,Challenger,House,Indiana,Democrat,"RUFF, ANDY Democrat Indiana House","RUFF, ANDY Democrat Indiana House 2021"
1139,H0IN09195,"POWELL, MARK J. REV",DEM,IN,9,Challenger,House,Indiana,Democrat,"POWELL, MARK J. REV Democrat Indiana House","POWELL, MARK J. REV Democrat Indiana House 2021"
1140,H0IN09203,"O''GABHANN, JAMES C. III",DEM,IN,9,Challenger,House,Indiana,Democrat,"O''GABHANN, JAMES C. III Democrat Indiana House","O''GABHANN, JAMES C. III Democrat Indiana House 2021"
1141,H8IN09081,"CANON, DANIEL J",DEM,IN,9,Challenger,House,Indiana,Democrat,"CANON, DANIEL J Democrat Indiana House","CANON, DANIEL J Democrat Indiana House 2021"
1142,H8IN09107,"WATSON, LIZ",DEM,IN,9,Challenger,House,Indiana,Democrat,"WATSON, LIZ Democrat Indiana House","WATSON, LIZ Democrat Indiana House 2021"
1143,H0IN09070,"YOUNG, TODD CHRISTOPHER",REP,IN,9,Incumbent,House,Indiana,Republican,"YOUNG, TODD CHRISTOPHER Republican Indiana House","YOUNG, TODD CHRISTOPHER Republican Indiana House 2021"
1144,H6IN09150,"WALTZ, DARRYL BRENT JR",REP,IN,9,Open seat,House,Indiana,Republican,"WALTZ, DARRYL BRENT JR Republican Indiana House","WALTZ, DARRYL BRENT JR Republican Indiana House 2021"
1145,H6IN09168,"PFAFF, JAMES R",REP,IN,9,Open seat,House,Indiana,Republican,"PFAFF, JAMES R Republican Indiana House","PFAFF, JAMES R Republican Indiana House 2021"
1146,H6IN09176,"HOLLINGSWORTH, TREY",REP,IN,9,Incumbent,House,Indiana,Republican,"HOLLINGSWORTH, TREY Republican Indiana House","HOLLINGSWORTH, TREY Republican Indiana House 2021"
1147,H0IN09138,"KNOTT, GREG S",LIB,IN,9,Challenger,House,Indiana,Libertarian,"KNOTT, GREG S Libertarian Indiana House","KNOTT, GREG S Libertarian Indiana House 2021"
1148,H0IN09153,"MILLIS, TONYA LYNN",LIB,IN,9,Challenger,House,Indiana,Libertarian,"MILLIS, TONYA LYNN Libertarian Indiana House","MILLIS, TONYA LYNN Libertarian Indiana House 2021"
1149,H0KS01172,"BARNETT, KALI",DEM,KS,1,Open seat,House,Kansas,Democrat,"BARNETT, KALI Democrat Kansas House","BARNETT, KALI Democrat Kansas House 2021"
1150,H0KS01214,"DAVIS, CHRISTY",DEM,KS,1,Open seat,House,Kansas,Democrat,"DAVIS, CHRISTY Democrat Kansas House","DAVIS, CHRISTY Democrat Kansas House 2021"
1151,H4KS01059,"LAPOLICE, ALAN",DEM,KS,1,Challenger,House,Kansas,Democrat,"LAPOLICE, ALAN Democrat Kansas House","LAPOLICE, ALAN Democrat Kansas House 2021"
1152,H0KS01123,"MANN, TRACEY ROBERT",REP,KS,1,Open seat,House,Kansas,Republican,"MANN, TRACEY ROBERT Republican Kansas House","MANN, TRACEY ROBERT Republican Kansas House 2021"
1153,H0KS01198,"CLIFFORD, BILL DR",REP,KS,1,Open seat,House,Kansas,Republican,"CLIFFORD, BILL DR Republican Kansas House","CLIFFORD, BILL DR Republican Kansas House 2021"
1154,H0KS01222,"WAYMASTER, TROY",REP,KS,1,Open seat,House,Kansas,Republican,"WAYMASTER, TROY Republican Kansas House","WAYMASTER, TROY Republican Kansas House 2021"
1155,H6KS01146,"HUELSKAMP, TIMOTHY A REP.",REP,KS,1,Challenger,House,Kansas,Republican,"HUELSKAMP, TIMOTHY A REP. Republican Kansas House","HUELSKAMP, TIMOTHY A REP. Republican Kansas House 2021"
1156,H0KS02170,"HODGSON, ABBIE",DEM,KS,2,Challenger,House,Kansas,Democrat,"HODGSON, ABBIE Democrat Kansas House","HODGSON, ABBIE Democrat Kansas House 2021"
1157,H0KS02196,"DE LA ISLA, MICHELLE",DEM,KS,2,Challenger,House,Kansas,Democrat,"DE LA ISLA, MICHELLE Democrat Kansas House","DE LA ISLA, MICHELLE Democrat Kansas House 2021"
1158,H8KS02173,"DAVIS, PAUL T.",DEM,KS,2,Open seat,House,Kansas,Democrat,"DAVIS, PAUL T. Democrat Kansas House","DAVIS, PAUL T. Democrat Kansas House 2021"
1159,H0KS02188,"LATURNER, JAKE",REP,KS,2,Challenger,House,Kansas,Republican,"LATURNER, JAKE Republican Kansas House","LATURNER, JAKE Republican Kansas House 2021"
1160,H0KS02212,"TAYLOR, DENNIS R MR.",REP,KS,2,Challenger,House,Kansas,Republican,"TAYLOR, DENNIS R MR. Republican Kansas House","TAYLOR, DENNIS R MR. Republican Kansas House 2021"
1161,H8KS02157,"TYSON, CARYN",REP,KS,2,Open seat,House,Kansas,Republican,"TYSON, CARYN Republican Kansas House","TYSON, CARYN Republican Kansas House 2021"
1162,H8KS02181,"JONES, KEVIN",REP,KS,2,Open seat,House,Kansas,Republican,"JONES, KEVIN Republican Kansas House","JONES, KEVIN Republican Kansas House 2021"
1163,H8KS02199,"WATKINS, STEVEN C. JR.",REP,KS,2,Incumbent,House,Kansas,Republican,"WATKINS, STEVEN C. JR. Republican Kansas House","WATKINS, STEVEN C. JR. Republican Kansas House 2021"
1164,H6KS03241,"SIDIE, JAY",DEM,KS,3,Challenger,House,Kansas,Democrat,"SIDIE, JAY Democrat Kansas House","SIDIE, JAY Democrat Kansas House 2021"
1165,H8KS03106,"RAMSEY, ANDREA",DEM,KS,3,Challenger,House,Kansas,Democrat,"RAMSEY, ANDREA Democrat Kansas House","RAMSEY, ANDREA Democrat Kansas House 2021"
1166,H8KS03114,"NIERMANN, TOM",DEM,KS,3,Challenger,House,Kansas,Democrat,"NIERMANN, TOM Democrat Kansas House","NIERMANN, TOM Democrat Kansas House 2021"
1167,H8KS03122,"WELDER, BRENT",DEM,KS,3,Challenger,House,Kansas,Democrat,"WELDER, BRENT Democrat Kansas House","WELDER, BRENT Democrat Kansas House 2021"
1168,H8KS03155,"DAVIDS, SHARICE",DEM,KS,3,Incumbent,House,Kansas,Democrat,"DAVIDS, SHARICE Democrat Kansas House","DAVIDS, SHARICE Democrat Kansas House 2021"
1169,H0KS03137,"YODER, KEVIN",REP,KS,3,Challenger,House,Kansas,Republican,"YODER, KEVIN Republican Kansas House","YODER, KEVIN Republican Kansas House 2021"
1170,H0KS03228,"WEIR, SARA HART",REP,KS,3,Challenger,House,Kansas,Republican,"WEIR, SARA HART Republican Kansas House","WEIR, SARA HART Republican Kansas House 2021"
1171,H0KS03236,"ADKINS, AMANDA",REP,KS,3,Challenger,House,Kansas,Republican,"ADKINS, AMANDA Republican Kansas House","ADKINS, AMANDA Republican Kansas House 2021"
1172,H0KS03244,"FOSTER, ADRIENNE",REP,KS,3,Challenger,House,Kansas,Republican,"FOSTER, ADRIENNE Republican Kansas House","FOSTER, ADRIENNE Republican Kansas House 2021"
1173,H0KS03251,"BEEHLER, MICHAEL E.",REP,KS,3,Challenger,House,Kansas,Republican,"BEEHLER, MICHAEL E. Republican Kansas House","BEEHLER, MICHAEL E. Republican Kansas House 2021"
1174,H8KS04088,"LOMBARD, LAURA",DEM,KS,4,Challenger,House,Kansas,Democrat,"LOMBARD, LAURA Democrat Kansas House","LOMBARD, LAURA Democrat Kansas House 2021"
1175,H8KS04120,"THOMPSON, JAMES A MR.",DEM,KS,4,Challenger,House,Kansas,Democrat,"THOMPSON, JAMES A MR. Democrat Kansas House","THOMPSON, JAMES A MR. Democrat Kansas House 2021"
1176,H0KS04051,"POMPEO, MICHAEL R",REP,KS,4,Incumbent,House,Kansas,Republican,"POMPEO, MICHAEL R Republican Kansas House","POMPEO, MICHAEL R Republican Kansas House 2021"
1177,H8KS04112,"ESTES, RON",REP,KS,4,Incumbent,House,Kansas,Republican,"ESTES, RON Republican Kansas House","ESTES, RON Republican Kansas House 2021"
1178,H6KS04173,"WALZ-ALLEN, MIRANDA",IND,KS,4,Challenger,House,Kansas,Independent,"WALZ-ALLEN, MIRANDA Independent Kansas House","WALZ-ALLEN, MIRANDA Independent Kansas House 2021"
1179,H8KY01074,"WALKER, PAUL",DEM,KY,1,Challenger,House,Kentucky,Democrat,"WALKER, PAUL Democrat Kentucky House","WALKER, PAUL Democrat Kentucky House 2021"
1180,H6KY01110,"COMER, JAMES",REP,KY,1,Incumbent,House,Kentucky,Republican,"COMER, JAMES Republican Kentucky House","COMER, JAMES Republican Kentucky House 2021"
