,CAND_ID,CAND_NAME,CAND_PTY_AFFILIATION,CAND_OFFICE_ST,CAND_OFFICE_DISTRICT,CAND_ICI,ELECT_TYPE,STATE_FULL,CAND_PTY_AFFILIATION_FULL,search_query,campaign_results_list
2925,H0UT01155,"SHEPHERD, MARK",REP,UT,1,Open seat,House,Utah,Republican,"SHEPHERD, MARK Republican Utah House","SHEPHERD, MARK Republican Utah House 2021"
2926,H0UT01163,"STEVENSON, BOB",REP,UT,1,Open seat,House,Utah,Republican,"STEVENSON, BOB Republican Utah House","STEVENSON, BOB Republican Utah House 2021"
2927,H0UT01171,"GIBSON, KERRY W.",REP,UT,1,Open seat,House,Utah,Republican,"GIBSON, KERRY W. Republican Utah House","GIBSON, KERRY W. Republican Utah House 2021"
2928,H0UT01189,"DURBANO, DOUGLAS",REP,UT,1,Open seat,House,Utah,Republican,"DURBANO, DOUGLAS Republican Utah House","DURBANO, DOUGLAS Republican Utah House 2021"
2929,H0UT01205,"MOORE, BLAKE",REP,UT,1,Open seat,House,Utah,Republican,"MOORE, BLAKE Republican Utah House","MOORE, BLAKE Republican Utah House 2021"
2930,H2UT01094,"BISHOP, ROBERT",REP,UT,1,Incumbent,House,Utah,Republican,"BISHOP, ROBERT Republican Utah House","BISHOP, ROBERT Republican Utah House 2021"
2931,H2UT02316,"WALLACK, HOWARD",REP,UT,1,Open seat,House,Utah,Republican,"WALLACK, HOWARD Republican Utah House","WALLACK, HOWARD Republican Utah House 2021"
2932,H8UT01133,"ELIASON, ERIC R",UNI,UT,1,Challenger,House,Utah,Other,"ELIASON, ERIC R Other Utah House","ELIASON, ERIC R Other Utah House 2021"
2933,H0UT02286,"JOLIN, ASHLEY",DEM,UT,2,Challenger,House,Utah,Democrat,"JOLIN, ASHLEY Democrat Utah House","JOLIN, ASHLEY Democrat Utah House 2021"
2934,H0UT02302,"WESTON, JOHN KAEL MR",DEM,UT,2,Challenger,House,Utah,Democrat,"WESTON, JOHN KAEL MR Democrat Utah House","WESTON, JOHN KAEL MR Democrat Utah House 2021"
2935,H8UT02255,"GHORBANI, SHIREEN SARAH",DEM,UT,2,Challenger,House,Utah,Democrat,"GHORBANI, SHIREEN SARAH Democrat Utah House","GHORBANI, SHIREEN SARAH Democrat Utah House 2021"
2936,H8UT02271,"HOPKINS, RANDY",DEM,UT,2,Challenger,House,Utah,Democrat,"HOPKINS, RANDY Democrat Utah House","HOPKINS, RANDY Democrat Utah House 2021"
2937,H0UT02245,"BURKETT, MARY",REP,UT,2,Challenger,House,Utah,Republican,"BURKETT, MARY Republican Utah House","BURKETT, MARY Republican Utah House 2021"
2938,H0UT02294,"JORGENSEN, CARSON",REP,UT,2,Challenger,House,Utah,Republican,"JORGENSEN, CARSON Republican Utah House","JORGENSEN, CARSON Republican Utah House 2021"
2939,H2UT00013,"BUCK, JASON",REP,UT,2,Challenger,House,Utah,Republican,"BUCK, JASON Republican Utah House","BUCK, JASON Republican Utah House 2021"
2940,H2UT02324,"STEWART, CHRIS",REP,UT,2,Incumbent,House,Utah,Republican,"STEWART, CHRIS Republican Utah House","STEWART, CHRIS Republican Utah House 2021"
2941,H8UT02248,"BURKETT, MARY",REP,UT,2,Challenger,House,Utah,Republican,"BURKETT, MARY Republican Utah House","BURKETT, MARY Republican Utah House 2021"
2942,H0UT02310,"JARVIS, JOSEPH QUINN DR.",OTH,UT,2,Challenger,House,Utah,Other,"JARVIS, JOSEPH QUINN DR. Other Utah House","JARVIS, JOSEPH QUINN DR. Other Utah House 2021"
2943,H8UT02305,"GARBETT, JAN",UNK,UT,2,Challenger,House,Utah,Other,"GARBETT, JAN Other Utah House","GARBETT, JAN Other Utah House 2021"
2944,H0UT03193,"THORPE, DEVIN D",DEM,UT,3,Challenger,House,Utah,Democrat,"THORPE, DEVIN D Democrat Utah House","THORPE, DEVIN D Democrat Utah House 2021"
2945,H0UT03201,"ROBINSON, TREY",DEM,UT,3,Challenger,House,Utah,Democrat,"ROBINSON, TREY Democrat Utah House","ROBINSON, TREY Democrat Utah House 2021"
2946,H0UT03219,"ANDERSON, JARED LYLE",DEM,UT,3,Challenger,House,Utah,Democrat,"ANDERSON, JARED LYLE Democrat Utah House","ANDERSON, JARED LYLE Democrat Utah House 2021"
2947,H8UT03139,"ALLEN, KATHRY",DEM,UT,3,Open seat,House,Utah,Democrat,"ALLEN, KATHRY Democrat Utah House","ALLEN, KATHRY Democrat Utah House 2021"
2948,H8UT03402,"SINGER, JAMES COURAGE",DEM,UT,3,Challenger,House,Utah,Democrat,"SINGER, JAMES COURAGE Democrat Utah House","SINGER, JAMES COURAGE Democrat Utah House 2021"
2949,H0UT03227,"AADLER, TIM",REP,UT,3,Challenger,House,Utah,Republican,"AADLER, TIM Republican Utah House","AADLER, TIM Republican Utah House 2021"
2950,H6UT03166,"TENG, CHIA-CHI",REP,UT,3,Challenger,House,Utah,Republican,"TENG, CHIA-CHI Republican Utah House","TENG, CHIA-CHI Republican Utah House 2021"
2951,H8UT03238,"CURTIS, JOHN",REP,UT,3,Incumbent,House,Utah,Republican,"CURTIS, JOHN Republican Utah House","CURTIS, JOHN Republican Utah House 2021"
2952,H0UT03185,"FUGAL, RUSSEL",IND,UT,3,Challenger,House,Utah,Independent,"FUGAL, RUSSEL Independent Utah House","FUGAL, RUSSEL Independent Utah House 2021"
2953,H0UT03243,"MCNEILL, THOMAS G.",OTH,UT,3,Challenger,House,Utah,Other,"MCNEILL, THOMAS G. Other Utah House","MCNEILL, THOMAS G. Other Utah House 2021"
2954,H0UT03250,"MCNEILL, THOMAS G.",OTH,UT,3,Challenger,House,Utah,Other,"MCNEILL, THOMAS G. Other Utah House","MCNEILL, THOMAS G. Other Utah House 2021"
2955,H0UT02096,"MATHESON, JAMES DAVID",DEM,UT,4,Challenger,House,Utah,Democrat,"MATHESON, JAMES DAVID Democrat Utah House","MATHESON, JAMES DAVID Democrat Utah House 2021"
2956,H0UT04084,"BECKSTRAND, DANIEL",DEM,UT,4,Challenger,House,Utah,Democrat,"BECKSTRAND, DANIEL Democrat Utah House","BECKSTRAND, DANIEL Democrat Utah House 2021"
2957,H4UT04011,"OWENS, H DOUGLAS",DEM,UT,4,Challenger,House,Utah,Democrat,"OWENS, H DOUGLAS Democrat Utah House","OWENS, H DOUGLAS Democrat Utah House 2021"
2958,H8UT04053,"MCADAMS, BEN",DEM,UT,4,Incumbent,House,Utah,Democrat,"MCADAMS, BEN Democrat Utah House","MCADAMS, BEN Democrat Utah House 2021"
2959,H0UT04019,"ANDERSON, KATHLEEN",REP,UT,4,Challenger,House,Utah,Republican,"ANDERSON, KATHLEEN Republican Utah House","ANDERSON, KATHLEEN Republican Utah House 2021"
2960,H0UT04035,"MCFARLAND, JAY",REP,UT,4,Challenger,House,Utah,Republican,"MCFARLAND, JAY Republican Utah House","MCFARLAND, JAY Republican Utah House 2021"
2961,H0UT04043,"COLEMAN, KIM",REP,UT,4,Challenger,House,Utah,Republican,"COLEMAN, KIM Republican Utah House","COLEMAN, KIM Republican Utah House 2021"
2962,H0UT04050,"HEMMERT, DAN",REP,UT,4,Challenger,House,Utah,Republican,"HEMMERT, DAN Republican Utah House","HEMMERT, DAN Republican Utah House 2021"
2963,H0UT04068,"BIESINGER, CHRIS",REP,UT,4,Challenger,House,Utah,Republican,"BIESINGER, CHRIS Republican Utah House","BIESINGER, CHRIS Republican Utah House 2021"
2964,H0UT04076,"OWENS, BURGESS",REP,UT,4,Challenger,House,Utah,Republican,"OWENS, BURGESS Republican Utah House","OWENS, BURGESS Republican Utah House 2021"
2965,H0UT04092,"CHRISTENSEN, TRENT MR.",REP,UT,4,Challenger,House,Utah,Republican,"CHRISTENSEN, TRENT MR. Republican Utah House","CHRISTENSEN, TRENT MR. Republican Utah House 2021"
2966,H0UT04027,"BRODERICK, JONIA MARIE",OTH,UT,4,Challenger,House,Utah,Other,"BRODERICK, JONIA MARIE Other Utah House","BRODERICK, JONIA MARIE Other Utah House 2021"
2967,H4VA00049,"MARSHALL, ROBERT G",REP,VA,0,Challenger,House,Virginia,Republican,"MARSHALL, ROBERT G Republican Virginia House","MARSHALL, ROBERT G Republican Virginia House 2021"
2968,H0VA01235,"RASHID, QASIM",DEM,VA,1,Challenger,House,Virginia,Democrat,"RASHID, QASIM Democrat Virginia House","RASHID, QASIM Democrat Virginia House 2021"
2969,H8VA01253,"SANTANA, EDWIN JR",DEM,VA,1,Challenger,House,Virginia,Democrat,"SANTANA, EDWIN JR Democrat Virginia House","SANTANA, EDWIN JR Democrat Virginia House 2021"
2970,H8VA01303,"WILLIAMS, LAVANGELENE A",DEM,VA,1,Challenger,House,Virginia,Democrat,"WILLIAMS, LAVANGELENE A Democrat Virginia House","WILLIAMS, LAVANGELENE A Democrat Virginia House 2021"
2971,H8VA01147,"WITTMAN, ROBERT J MR.",REP,VA,1,Incumbent,House,Virginia,Republican,"WITTMAN, ROBERT J MR. Republican Virginia House","WITTMAN, ROBERT J MR. Republican Virginia House 2021"
2972,H8VA01220,"ENNIS, CRAIG E",UNK,VA,1,Challenger,House,Virginia,Other,"ENNIS, CRAIG E Other Virginia House","ENNIS, CRAIG E Other Virginia House 2021"
2973,H4VA02029,"ASHE, DAVID BENJAMIN",DEM,VA,2,Challenger,House,Virginia,Democrat,"ASHE, DAVID BENJAMIN Democrat Virginia House","ASHE, DAVID BENJAMIN Democrat Virginia House 2021"
2974,H6VA02115,"BROWN, SHAUN DENISE",DEM,VA,2,Challenger,House,Virginia,Democrat,"BROWN, SHAUN DENISE Democrat Virginia House","BROWN, SHAUN DENISE Democrat Virginia House 2021"
2975,H8VA02111,"LURIA, ELAINE",DEM,VA,2,Incumbent,House,Virginia,Democrat,"LURIA, ELAINE Democrat Virginia House","LURIA, ELAINE Democrat Virginia House 2021"
2976,H0VA02092,"LOYOLA, BENITO BEN JR",REP,VA,2,Challenger,House,Virginia,Republican,"LOYOLA, BENITO BEN JR Republican Virginia House","LOYOLA, BENITO BEN JR Republican Virginia House 2021"
2977,H0VA02118,"TAYLOR, SCOTT W. MR.",REP,VA,2,Challenger,House,Virginia,Republican,"TAYLOR, SCOTT W. MR. Republican Virginia House","TAYLOR, SCOTT W. MR. Republican Virginia House 2021"
2978,H0VA02167,"BAAN, ANDY",REP,VA,2,Challenger,House,Virginia,Republican,"BAAN, ANDY Republican Virginia House","BAAN, ANDY Republican Virginia House 2021"
2979,H0VA02175,"BELL, JAROME",REP,VA,2,Challenger,House,Virginia,Republican,"BELL, JAROME Republican Virginia House","BELL, JAROME Republican Virginia House 2021"
2980,H6VA02107,"CARDWELL, CHARLES PATTESON IV",REP,VA,2,Open seat,House,Virginia,Republican,"CARDWELL, CHARLES PATTESON IV Republican Virginia House","CARDWELL, CHARLES PATTESON IV Republican Virginia House 2021"
2981,H6VA01117,"SCOTT, ROBERT C",DEM,VA,3,Incumbent,House,Virginia,Democrat,"SCOTT, ROBERT C Democrat Virginia House","SCOTT, ROBERT C Democrat Virginia House 2021"
2982,H0VA03124,"COLLICK, JOHN WILLIAM MR. JR.",REP,VA,3,Challenger,House,Virginia,Republican,"COLLICK, JOHN WILLIAM MR. JR. Republican Virginia House","COLLICK, JOHN WILLIAM MR. JR. Republican Virginia House 2021"
2983,H0VA03132,"MADISON DOWNS, JOHN HARRISON",REP,VA,3,Challenger,House,Virginia,Republican,"MADISON DOWNS, JOHN HARRISON Republican Virginia House","MADISON DOWNS, JOHN HARRISON Republican Virginia House 2021"
2984,H0VA03140,"BURKE, GEOFFREY R",REP,VA,3,Challenger,House,Virginia,Republican,"BURKE, GEOFFREY R Republican Virginia House","BURKE, GEOFFREY R Republican Virginia House 2021"
2985,H0VA03165,"YACUS, GEORGE MICHAEL",REP,VA,3,Challenger,House,Virginia,Republican,"YACUS, GEORGE MICHAEL Republican Virginia House","YACUS, GEORGE MICHAEL Republican Virginia House 2021"
2986,H0VA04080,"LEVINE, RONGERLIS CAZEL",DEM,VA,4,Challenger,House,Virginia,Democrat,"LEVINE, RONGERLIS CAZEL Democrat Virginia House","LEVINE, RONGERLIS CAZEL Democrat Virginia House 2021"
2987,H6VA04061,"MCEACHIN, ASTON DONALD",DEM,VA,4,Incumbent,House,Virginia,Democrat,"MCEACHIN, ASTON DONALD Democrat Virginia House","MCEACHIN, ASTON DONALD Democrat Virginia House 2021"
2988,H0VA04064,"BENJAMIN, LEON MR. SR.",REP,VA,4,Challenger,House,Virginia,Republican,"BENJAMIN, LEON MR. SR. Republican Virginia House","BENJAMIN, LEON MR. SR. Republican Virginia House 2021"
2989,H8VA04026,"MCADAMS, RYAN A. MR.",REP,VA,4,Challenger,House,Virginia,Republican,"MCADAMS, RYAN A. MR. Republican Virginia House","MCADAMS, RYAN A. MR. Republican Virginia House 2021"
2990,H0VA05137,"DAUGHERTY, KIMBERLY MARIE",DEM,VA,5,Challenger,House,Virginia,Democrat,"DAUGHERTY, KIMBERLY MARIE Democrat Virginia House","DAUGHERTY, KIMBERLY MARIE Democrat Virginia House 2021"
2991,H0VA05145,"WEBB, BRYANT CAMERON DR.",DEM,VA,5,Challenger,House,Virginia,Democrat,"WEBB, BRYANT CAMERON DR. Democrat Virginia House","WEBB, BRYANT CAMERON DR. Democrat Virginia House 2021"
2992,H0VA05152,"LESINSKI, JOHN",DEM,VA,5,Challenger,House,Virginia,Democrat,"LESINSKI, JOHN Democrat Virginia House","LESINSKI, JOHN Democrat Virginia House 2021"
2993,H0VA05178,"RUSSO, CLAIRE",DEM,VA,5,Challenger,House,Virginia,Democrat,"RUSSO, CLAIRE Democrat Virginia House","RUSSO, CLAIRE Democrat Virginia House 2021"
2994,H2VA10117,"DOUGLASS, JOHN WADE",DEM,VA,5,Challenger,House,Virginia,Democrat,"DOUGLASS, JOHN WADE Democrat Virginia House","DOUGLASS, JOHN WADE Democrat Virginia House 2021"
2995,H8VA05114,"HUFFSTETLER, ROGER DEAN RD",DEM,VA,5,Challenger,House,Virginia,Democrat,"HUFFSTETLER, ROGER DEAN RD Democrat Virginia House","HUFFSTETLER, ROGER DEAN RD Democrat Virginia House 2021"
2996,H8VA05155,"COCKBURN, LESLIE",DEM,VA,5,Open seat,House,Virginia,Democrat,"COCKBURN, LESLIE Democrat Virginia House","COCKBURN, LESLIE Democrat Virginia House 2021"
2997,H8VA10189,"AYYAS, SHADI",DEM,VA,5,Challenger,House,Virginia,Democrat,"AYYAS, SHADI Democrat Virginia House","AYYAS, SHADI Democrat Virginia House 2021"
2998,H0VA05095,"HURT, ROBERT",REP,VA,5,Incumbent,House,Virginia,Republican,"HURT, ROBERT Republican Virginia House","HURT, ROBERT Republican Virginia House 2021"
2999,H0VA05160,"GOOD, ROBERT G.",REP,VA,5,Challenger,House,Virginia,Republican,"GOOD, ROBERT G. Republican Virginia House","GOOD, ROBERT G. Republican Virginia House 2021"
3000,H6VA05142,"GARRETT, THOMAS ALEXANDER MR. JR.",REP,VA,5,Incumbent,House,Virginia,Republican,"GARRETT, THOMAS ALEXANDER MR. JR. Republican Virginia House","GARRETT, THOMAS ALEXANDER MR. JR. Republican Virginia House 2021"
3001,H8VA05171,"RIGGLEMAN, DENVER LEE MR. III",REP,VA,5,Incumbent,House,Virginia,Republican,"RIGGLEMAN, DENVER LEE MR. III Republican Virginia House","RIGGLEMAN, DENVER LEE MR. III Republican Virginia House 2021"
3002,H0VA06044,"BETTS, NICHOLAS",DEM,VA,6,Challenger,House,Virginia,Democrat,"BETTS, NICHOLAS Democrat Virginia House","BETTS, NICHOLAS Democrat Virginia House 2021"
3003,H8VA06138,"LEWIS, JENNIFER LYNN",DEM,VA,6,Open seat,House,Virginia,Democrat,"LEWIS, JENNIFER LYNN Democrat Virginia House","LEWIS, JENNIFER LYNN Democrat Virginia House 2021"
3004,H8VA06096,"DUNBAR, CYNTHIA",REP,VA,6,Open seat,House,Virginia,Republican,"DUNBAR, CYNTHIA Republican Virginia House","DUNBAR, CYNTHIA Republican Virginia House 2021"
3005,H8VA06104,"CLINE, BENJAMIN LEE",REP,VA,6,Incumbent,House,Virginia,Republican,"CLINE, BENJAMIN LEE Republican Virginia House","CLINE, BENJAMIN LEE Republican Virginia House 2021"
3006,H8VA06112,"HAYWOOD, CHARLES W. MR.",REP,VA,6,Open seat,House,Virginia,Republican,"HAYWOOD, CHARLES W. MR. Republican Virginia House","HAYWOOD, CHARLES W. MR. Republican Virginia House 2021"
3007,H8VA07094,"SPANBERGER, ABIGAIL",DEM,VA,7,Incumbent,House,Virginia,Democrat,"SPANBERGER, ABIGAIL Democrat Virginia House","SPANBERGER, ABIGAIL Democrat Virginia House 2021"
3008,H0VA07109,"RAMIREZ, TINA MARIE MRS.",REP,VA,7,Challenger,House,Virginia,Republican,"RAMIREZ, TINA MARIE MRS. Republican Virginia House","RAMIREZ, TINA MARIE MRS. Republican Virginia House 2021"
3009,H0VA07117,"ROBERGE, JASON ALEXANDER",REP,VA,7,Challenger,House,Virginia,Republican,"ROBERGE, JASON ALEXANDER Republican Virginia House","ROBERGE, JASON ALEXANDER Republican Virginia House 2021"
3010,H0VA07125,"KNAGGS, ANDREW FERRIERES",REP,VA,7,Challenger,House,Virginia,Republican,"KNAGGS, ANDREW FERRIERES Republican Virginia House","KNAGGS, ANDREW FERRIERES Republican Virginia House 2021"
3011,H0VA07133,"MCGUIRE, JOHN J. MR. III",REP,VA,7,Challenger,House,Virginia,Republican,"MCGUIRE, JOHN J. MR. III Republican Virginia House","MCGUIRE, JOHN J. MR. III Republican Virginia House 2021"
3012,H0VA07141,"WILLIAMS, BRIDGETTE",REP,VA,7,Challenger,House,Virginia,Republican,"WILLIAMS, BRIDGETTE Republican Virginia House","WILLIAMS, BRIDGETTE Republican Virginia House 2021"
3013,H0VA07158,"FREITAS, NICK J",REP,VA,7,Challenger,House,Virginia,Republican,"FREITAS, NICK J Republican Virginia House","FREITAS, NICK J Republican Virginia House 2021"
3014,H4VA07127,"GREENWALD, PETER THOMAS",REP,VA,7,Challenger,House,Virginia,Republican,"GREENWALD, PETER THOMAS Republican Virginia House","GREENWALD, PETER THOMAS Republican Virginia House 2021"
3015,H4VA07143,"BRAT, DAVID ALAN",REP,VA,7,Challenger,House,Virginia,Republican,"BRAT, DAVID ALAN Republican Virginia House","BRAT, DAVID ALAN Republican Virginia House 2021"
3016,H8VA07128,"WALTON, JOSEPH BUCKLER",LIB,VA,7,Challenger,House,Virginia,Libertarian,"WALTON, JOSEPH BUCKLER Libertarian Virginia House","WALTON, JOSEPH BUCKLER Libertarian Virginia House 2021"
3017,H0VA08040,"MORAN, JAMES P. JR.",DEM,VA,8,Challenger,House,Virginia,Democrat,"MORAN, JAMES P. JR. Democrat Virginia House","MORAN, JAMES P. JR. Democrat Virginia House 2021"
3018,H4VA08216,"HOPE, PATRICK ALAN",DEM,VA,8,Challenger,House,Virginia,Democrat,"HOPE, PATRICK ALAN Democrat Virginia House","HOPE, PATRICK ALAN Democrat Virginia House 2021"
3019,H4VA08224,"BEYER, DONALD STERNOFF HONORABLE JR.",DEM,VA,8,Incumbent,House,Virginia,Democrat,"BEYER, DONALD STERNOFF HONORABLE JR. Democrat Virginia House","BEYER, DONALD STERNOFF HONORABLE JR. Democrat Virginia House 2021"
3020,H4VA08281,"LEVINE, MARK HERBERT",DEM,VA,8,Open seat,House,Virginia,Democrat,"LEVINE, MARK HERBERT Democrat Virginia House","LEVINE, MARK HERBERT Democrat Virginia House 2021"
3021,H0VA08180,"ELLMORE, MARK W",REP,VA,8,Challenger,House,Virginia,Republican,"ELLMORE, MARK W Republican Virginia House","ELLMORE, MARK W Republican Virginia House 2021"
3022,H0VA08198,"JORDAN, JEFF",REP,VA,8,Challenger,House,Virginia,Republican,"JORDAN, JEFF Republican Virginia House","JORDAN, JEFF Republican Virginia House 2021"
3023,H6VA08211,"ELLMORE, MARK W",REP,VA,8,Challenger,House,Virginia,Republican,"ELLMORE, MARK W Republican Virginia House","ELLMORE, MARK W Republican Virginia House 2021"
3024,H6VA08229,"WEBB, MICHAEL DAVID",REP,VA,8,Challenger,House,Virginia,Republican,"WEBB, MICHAEL DAVID Republican Virginia House","WEBB, MICHAEL DAVID Republican Virginia House 2021"
3025,H8VA08159,"OH, THOMAS",REP,VA,8,Challenger,House,Virginia,Republican,"OH, THOMAS Republican Virginia House","OH, THOMAS Republican Virginia House 2021"
3026,H8VA08167,"WEBB, MAJOR MIKE MR.",REP,VA,8,Challenger,House,Virginia,Republican,"WEBB, MAJOR MIKE MR. Republican Virginia House","WEBB, MAJOR MIKE MR. Republican Virginia House 2021"
3027,H0VA08172,"KIM, HEERAK CHRISTIAN",NPA,VA,8,Challenger,House,Virginia,Other,"KIM, HEERAK CHRISTIAN Other Virginia House","KIM, HEERAK CHRISTIAN Other Virginia House 2021"
3028,H0VA09121,"DICKERSON, CAMERON D.",DEM,VA,9,Challenger,House,Virginia,Democrat,"DICKERSON, CAMERON D. Democrat Virginia House","DICKERSON, CAMERON D. Democrat Virginia House 2021"
3029,H0VA09055,"GRIFFITH, H MORGAN",REP,VA,9,Incumbent,House,Virginia,Republican,"GRIFFITH, H MORGAN Republican Virginia House","GRIFFITH, H MORGAN Republican Virginia House 2021"
3030,H0VA10129,"MODICA, JULIEN",DEM,VA,10,Challenger,House,Virginia,Democrat,"MODICA, JULIEN Democrat Virginia House","MODICA, JULIEN Democrat Virginia House 2021"
3031,H8VA10098,"STOVER, LINDSEY DAVIS",DEM,VA,10,Challenger,House,Virginia,Democrat,"STOVER, LINDSEY DAVIS Democrat Virginia House","STOVER, LINDSEY DAVIS Democrat Virginia House 2021"
3032,H8VA10106,"WEXTON, JENNIFER",DEM,VA,10,Incumbent,House,Virginia,Democrat,"WEXTON, JENNIFER Democrat Virginia House","WEXTON, JENNIFER Democrat Virginia House 2021"
3033,H8VA10122,"FRIEDMAN, ALISON",DEM,VA,10,Challenger,House,Virginia,Democrat,"FRIEDMAN, ALISON Democrat Virginia House","FRIEDMAN, ALISON Democrat Virginia House 2021"
3034,H8VA10171,"PELLETIER, PAUL",DEM,VA,10,Challenger,House,Virginia,Democrat,"PELLETIER, PAUL Democrat Virginia House","PELLETIER, PAUL Democrat Virginia House 2021"
3035,H0VA10160,"JONES, ROB",REP,VA,10,Challenger,House,Virginia,Republican,"JONES, ROB Republican Virginia House","JONES, ROB Republican Virginia House 2021"
3036,H0VA10178,"STONE, ELIZABETH",REP,VA,10,Challenger,House,Virginia,Republican,"STONE, ELIZABETH Republican Virginia House","STONE, ELIZABETH Republican Virginia House 2021"
3037,H0VA10186,"ANDREWS, ALISCIA",REP,VA,10,Challenger,House,Virginia,Republican,"ANDREWS, ALISCIA Republican Virginia House","ANDREWS, ALISCIA Republican Virginia House 2021"
3038,H0VA10194,"TRUONG, MATTHEW DO MR",REP,VA,10,Challenger,House,Virginia,Republican,"TRUONG, MATTHEW DO MR Republican Virginia House","TRUONG, MATTHEW DO MR Republican Virginia House 2021"
3039,H4VA10089,"COMSTOCK, BARBARA",REP,VA,10,Incumbent,House,Virginia,Republican,"COMSTOCK, BARBARA Republican Virginia House","COMSTOCK, BARBARA Republican Virginia House 2021"
3040,H4VA10113,"WASINGER, ROBERT K",REP,VA,10,Open seat,House,Virginia,Republican,"WASINGER, ROBERT K Republican Virginia House","WASINGER, ROBERT K Republican Virginia House 2021"
3041,H8VA10155,"HILL, SHAK",REP,VA,10,Challenger,House,Virginia,Republican,"HILL, SHAK Republican Virginia House","HILL, SHAK Republican Virginia House 2021"
3042,H8VA11070,"DOVE, JEFFERY ANTHONY MR. JR.",REP,VA,10,Challenger,House,Virginia,Republican,"DOVE, JEFFERY ANTHONY MR. JR. Republican Virginia House","DOVE, JEFFERY ANTHONY MR. JR. Republican Virginia House 2021"
3043,H0VA10145,"REDPATH, WILLIAM B",LIB,VA,10,Open seat,House,Virginia,Libertarian,"REDPATH, WILLIAM B Libertarian Virginia House","REDPATH, WILLIAM B Libertarian Virginia House 2021"
3044,H0VA11119,"MOHSINI, ZAINAB",DEM,VA,11,Challenger,House,Virginia,Democrat,"MOHSINI, ZAINAB Democrat Virginia House","MOHSINI, ZAINAB Democrat Virginia House 2021"
3045,H8VA11062,"CONNOLLY, GERALD EDWARD",DEM,VA,11,Incumbent,House,Virginia,Democrat,"CONNOLLY, GERALD EDWARD Democrat Virginia House","CONNOLLY, GERALD EDWARD Democrat Virginia House 2021"
3046,H0VA11077,"HERRITY, PATRICK S",REP,VA,11,Challenger,House,Virginia,Republican,"HERRITY, PATRICK S Republican Virginia House","HERRITY, PATRICK S Republican Virginia House 2021"
3047,H0VA11127,"ANANTATMULA, MANGA MANGA",REP,VA,11,Challenger,House,Virginia,Republican,"ANANTATMULA, MANGA MANGA Republican Virginia House","ANANTATMULA, MANGA MANGA Republican Virginia House 2021"
3048,H2VA11164,"GALDO, JOSEPH F",GRE,VA,11,Challenger,House,Virginia,Green,"GALDO, JOSEPH F Green Virginia House","GALDO, JOSEPH F Green Virginia House 2021"
3049,H8VA11088,"PORTER, STEVAN MICHAEL MR.",LIB,VA,11,Challenger,House,Virginia,Libertarian,"PORTER, STEVAN MICHAEL MR. Libertarian Virginia House","PORTER, STEVAN MICHAEL MR. Libertarian Virginia House 2021"
3050,H2VI00082,"PLASKETT, STACEY",DEM,VI,0,Incumbent,House,Virgin Islands,Democrat,"PLASKETT, STACEY Democrat Virgin Islands House","PLASKETT, STACEY Democrat Virgin Islands House 2021"
3051,H0VT01054,"STRAW, ANDREW U. D. ESQ.",DEM,VT,0,Challenger,House,Vermont,Democrat,"STRAW, ANDREW U. D. ESQ. Democrat Vermont House","STRAW, ANDREW U. D. ESQ. Democrat Vermont House 2021"
3052,H6VT00160,"WELCH, PETER",DEM,VT,0,Incumbent,House,Vermont,Democrat,"WELCH, PETER Democrat Vermont House","WELCH, PETER Democrat Vermont House 2021"
3053,H8VT01040,"FREILICH, DANIEL ADAM",DEM,VT,0,Challenger,House,Vermont,Democrat,"FREILICH, DANIEL ADAM Democrat Vermont House","FREILICH, DANIEL ADAM Democrat Vermont House 2021"
3054,H0VT01062,"RODRIGUEZ, JIMMY",REP,VT,0,Challenger,House,Vermont,Republican,"RODRIGUEZ, JIMMY Republican Vermont House","RODRIGUEZ, JIMMY Republican Vermont House 2021"
3055,H8VT01065,"TYNIO, NATASHA",REP,VT,0,Challenger,House,Vermont,Republican,"TYNIO, NATASHA Republican Vermont House","TYNIO, NATASHA Republican Vermont House 2021"
3056,H0WA08046,"DELBENE, SUZAN K",DEM,WA,1,Incumbent,House,Washington,Democrat,"DELBENE, SUZAN K Democrat Washington House","DELBENE, SUZAN K Democrat Washington House 2021"
3057,H2WA08141,"GOODMAN, ROGER",DEM,WA,1,Open seat,House,Washington,Democrat,"GOODMAN, ROGER Democrat Washington House","GOODMAN, ROGER Democrat Washington House 2021"
3058,H0WA01124,"CHARTRAND, DEREK",REP,WA,1,Challenger,House,Washington,Republican,"CHARTRAND, DEREK Republican Washington House","CHARTRAND, DEREK Republican Washington House 2021"
3059,H8WA01077,"BEELER, JEFFREY ALLEN SR.",REP,WA,1,Challenger,House,Washington,Republican,"BEELER, JEFFREY ALLEN SR. Republican Washington House","BEELER, JEFFREY ALLEN SR. Republican Washington House 2021"
3060,H0WA02080,"LARSEN, RICK",DEM,WA,2,Incumbent,House,Washington,Democrat,"LARSEN, RICK Democrat Washington House","LARSEN, RICK Democrat Washington House 2021"
3061,H0WA02189,"CALL, JASON",DEM,WA,2,Challenger,House,Washington,Democrat,"CALL, JASON Democrat Washington House","CALL, JASON Democrat Washington House 2021"
3062,H0WA02197,"HAZELO, TIMOTHY SCOTT",REP,WA,2,Challenger,House,Washington,Republican,"HAZELO, TIMOTHY SCOTT Republican Washington House","HAZELO, TIMOTHY SCOTT Republican Washington House 2021"
3063,H8WA02190,"BIRD, STONEWALL (STONEY) JACKSON",GRE,WA,2,Challenger,House,Washington,Green,"BIRD, STONEWALL (STONEY) JACKSON Green Washington House","BIRD, STONEWALL (STONEY) JACKSON Green Washington House 2021"
3064,H0WA03237,"KHALIL, PETER",DEM,WA,3,Challenger,House,Washington,Democrat,"KHALIL, PETER Democrat Washington House","KHALIL, PETER Democrat Washington House 2021"
3065,H6WA03135,"BAIRD, BRIAN N.",DEM,WA,3,Incumbent,House,Washington,Democrat,"BAIRD, BRIAN N. Democrat Washington House","BAIRD, BRIAN N. Democrat Washington House 2021"
3066,H8WA03180,"HARRISON, PETER JOHN MR.",DEM,WA,3,Challenger,House,Washington,Democrat,"HARRISON, PETER JOHN MR. Democrat Washington House","HARRISON, PETER JOHN MR. Democrat Washington House 2021"
3067,H8WA03198,"LONG, CAROLYN N.",DEM,WA,3,Challenger,House,Washington,Democrat,"LONG, CAROLYN N. Democrat Washington House","LONG, CAROLYN N. Democrat Washington House 2021"
3068,H0WA03138,"CASTILLO, DAVID B",REP,WA,3,Open seat,House,Washington,Republican,"CASTILLO, DAVID B Republican Washington House","CASTILLO, DAVID B Republican Washington House 2021"
3069,H0WA03187,"HERRERA BEUTLER, JAIME",REP,WA,3,Incumbent,House,Washington,Republican,"HERRERA BEUTLER, JAIME Republican Washington House","HERRERA BEUTLER, JAIME Republican Washington House 2021"
3070,H6WA04141,"MCKINLEY, DOUGLAS E. JR.",DEM,WA,4,Challenger,House,Washington,Democrat,"MCKINLEY, DOUGLAS E. JR. Democrat Washington House","MCKINLEY, DOUGLAS E. JR. Democrat Washington House 2021"
3071,H8WA04089,"BROWN, CHRISTINE CAROL",DEM,WA,4,Challenger,House,Washington,Democrat,"BROWN, CHRISTINE CAROL Democrat Washington House","BROWN, CHRISTINE CAROL Democrat Washington House 2021"
