,CAND_ID,CAND_NAME,CAND_PTY_AFFILIATION,CAND_OFFICE_ST,CAND_OFFICE_DISTRICT,CAND_ICI,ELECT_TYPE,STATE_FULL,CAND_PTY_AFFILIATION_FULL,search_query,campaign_results_list
2039,H6NY13105,"WRIGHT, KEITH L T",DEM,NY,13,Open seat,House,New York,Democrat,"WRIGHT, KEITH L T Democrat New York House","WRIGHT, KEITH L T Democrat New York House 2021"
2040,H0NY13165,"GWINN, LOVELYNN",REP,NY,13,Challenger,House,New York,Republican,"GWINN, LOVELYNN Republican New York House","GWINN, LOVELYNN Republican New York House 2021"
2041,H2NY13112,"MANTANONA, NICHOLAS MR",IND,NY,13,,House,New York,Independent,"MANTANONA, NICHOLAS MR Independent New York House","MANTANONA, NICHOLAS MR Independent New York House 2021"
2042,H0NY14304,"KHAN, BADRUN",DEM,NY,14,Challenger,House,New York,Democrat,"KHAN, BADRUN Democrat New York House","KHAN, BADRUN Democrat New York House 2021"
2043,H0NY14338,"CABRERA, FERNANDO",DEM,NY,14,Challenger,House,New York,Democrat,"CABRERA, FERNANDO Democrat New York House","CABRERA, FERNANDO Democrat New York House 2021"
2044,H0NY14346,"CARUSO-CABRERA, MICHELLE",DEM,NY,14,Challenger,House,New York,Democrat,"CARUSO-CABRERA, MICHELLE Democrat New York House","CARUSO-CABRERA, MICHELLE Democrat New York House 2021"
2045,H8NY07046,"CROWLEY, JOSEPH",DEM,NY,14,Incumbent,House,New York,Democrat,"CROWLEY, JOSEPH Democrat New York House","CROWLEY, JOSEPH Democrat New York House 2021"
2046,H8NY15148,"OCASIO-CORTEZ, ALEXANDRIA",DEM,NY,14,Incumbent,House,New York,Democrat,"OCASIO-CORTEZ, ALEXANDRIA Democrat New York House","OCASIO-CORTEZ, ALEXANDRIA Democrat New York House 2021"
2047,H0NY14239,"HERNANDEZ, MIGUEL",REP,NY,14,Challenger,House,New York,Republican,"HERNANDEZ, MIGUEL Republican New York House","HERNANDEZ, MIGUEL Republican New York House 2021"
2048,H0NY14247,"PAPAZIAN, RUTH MS",REP,NY,14,Challenger,House,New York,Republican,"PAPAZIAN, RUTH MS Republican New York House","PAPAZIAN, RUTH MS Republican New York House 2021"
2049,H0NY14254,"TUCKER, ANTOINE MR.",REP,NY,14,Challenger,House,New York,Republican,"TUCKER, ANTOINE MR. Republican New York House","TUCKER, ANTOINE MR. Republican New York House 2021"
2050,H0NY14262,"BUTLER, JINEEA",REP,NY,14,Challenger,House,New York,Republican,"BUTLER, JINEEA Republican New York House","BUTLER, JINEEA Republican New York House 2021"
2051,H0NY14270,"MURRAY, SCHERIE",REP,NY,14,Challenger,House,New York,Republican,"MURRAY, SCHERIE Republican New York House","MURRAY, SCHERIE Republican New York House 2021"
2052,H0NY14296,"CUMMINGS, JOHN C.",REP,NY,14,Challenger,House,New York,Republican,"CUMMINGS, JOHN C. Republican New York House","CUMMINGS, JOHN C. Republican New York House 2021"
2053,H0NY14312,"CRUZ, ISRAEL ORTEGA",REP,NY,14,Challenger,House,New York,Republican,"CRUZ, ISRAEL ORTEGA Republican New York House","CRUZ, ISRAEL ORTEGA Republican New York House 2021"
2054,H6NY14244,"SPOTORNO, FRANK",REP,NY,14,Challenger,House,New York,Republican,"SPOTORNO, FRANK Republican New York House","SPOTORNO, FRANK Republican New York House 2021"
2055,H0NY15152,"ORTIZ, JONATHAN",DEM,NY,15,Open seat,House,New York,Democrat,"ORTIZ, JONATHAN Democrat New York House","ORTIZ, JONATHAN Democrat New York House 2021"
2056,H0NY15160,"TORRES, RITCHIE JOHN",DEM,NY,15,Open seat,House,New York,Democrat,"TORRES, RITCHIE JOHN Democrat New York House","TORRES, RITCHIE JOHN Democrat New York House 2021"
2057,H0NY15178,"RAMOS, TOMAS",DEM,NY,15,Open seat,House,New York,Democrat,"RAMOS, TOMAS Democrat New York House","RAMOS, TOMAS Democrat New York House 2021"
2058,H0NY15186,"DIAZ, RUBEN REV. SR",DEM,NY,15,Open seat,House,New York,Democrat,"DIAZ, RUBEN REV. SR Democrat New York House","DIAZ, RUBEN REV. SR Democrat New York House 2021"
2059,H0NY15194,"BLAKE, MICHAEL ALEXANDER",DEM,NY,15,Open seat,House,New York,Democrat,"BLAKE, MICHAEL ALEXANDER Democrat New York House","BLAKE, MICHAEL ALEXANDER Democrat New York House 2021"
2060,H0NY15236,"BASORA, FRANGELL",DEM,NY,15,Open seat,House,New York,Democrat,"BASORA, FRANGELL Democrat New York House","BASORA, FRANGELL Democrat New York House 2021"
2061,H0NY15244,"MARK-VIVERITO, MELISSA",DEM,NY,15,Open seat,House,New York,Democrat,"MARK-VIVERITO, MELISSA Democrat New York House","MARK-VIVERITO, MELISSA Democrat New York House 2021"
2062,H0NY15251,"CINTRON, MARLENE",DEM,NY,15,Open seat,House,New York,Democrat,"CINTRON, MARLENE Democrat New York House","CINTRON, MARLENE Democrat New York House 2021"
2063,H0NY15269,"RODRIGUEZ, YDANIS",DEM,NY,15,Open seat,House,New York,Democrat,"RODRIGUEZ, YDANIS Democrat New York House","RODRIGUEZ, YDANIS Democrat New York House 2021"
2064,H0NY15277,"LOPEZ, SAMELYS",DEM,NY,15,Open seat,House,New York,Democrat,"LOPEZ, SAMELYS Democrat New York House","LOPEZ, SAMELYS Democrat New York House 2021"
2065,H0NY15285,"PABON, JULIO MR.",DEM,NY,15,Open seat,House,New York,Democrat,"PABON, JULIO MR. Democrat New York House","PABON, JULIO MR. Democrat New York House 2021"
2066,H0NY15293,"NEWSOME, CHIVONA RENEE",DEM,NY,15,Open seat,House,New York,Democrat,"NEWSOME, CHIVONA RENEE Democrat New York House","NEWSOME, CHIVONA RENEE Democrat New York House 2021"
2067,H0NY15301,"TAPPER, MARLENE J",DEM,NY,15,Open seat,House,New York,Democrat,"TAPPER, MARLENE J Democrat New York House","TAPPER, MARLENE J Democrat New York House 2021"
2068,H0NY18065,"SERRANO, JOSE E.",DEM,NY,15,Incumbent,House,New York,Democrat,"SERRANO, JOSE E. Democrat New York House","SERRANO, JOSE E. Democrat New York House 2021"
2069,H0NY15111,"FAULKNER , MICHEL",REP,NY,15,Challenger,House,New York,Republican,"FAULKNER , MICHEL Republican New York House","FAULKNER , MICHEL Republican New York House 2021"
2070,H0NY16127,"BELVIN, KENNETH LEWIS III",DEM,NY,16,Challenger,House,New York,Democrat,"BELVIN, KENNETH LEWIS III Democrat New York House","BELVIN, KENNETH LEWIS III Democrat New York House 2021"
2071,H0NY16135,"GHEBREGHIORGIS, ANDOM A.",DEM,NY,16,Challenger,House,New York,Democrat,"GHEBREGHIORGIS, ANDOM A. Democrat New York House","GHEBREGHIORGIS, ANDOM A. Democrat New York House 2021"
2072,H0NY16143,"BOWMAN, JAMAAL",DEM,NY,16,Challenger,House,New York,Democrat,"BOWMAN, JAMAAL Democrat New York House","BOWMAN, JAMAAL Democrat New York House 2021"
2073,H0NY16150,"RAVELO, SAMUEL",DEM,NY,16,Challenger,House,New York,Democrat,"RAVELO, SAMUEL Democrat New York House","RAVELO, SAMUEL Democrat New York House 2021"
2074,H0NY16168,"FINK, CHRIS",DEM,NY,16,Challenger,House,New York,Democrat,"FINK, CHRIS Democrat New York House","FINK, CHRIS Democrat New York House 2021"
2075,H8NY19058,"ENGEL, ELIOT L.",DEM,NY,16,Incumbent,House,New York,Democrat,"ENGEL, ELIOT L. Democrat New York House","ENGEL, ELIOT L. Democrat New York House 2021"
2076,H0NY17174,"JONES, MONDAIRE",DEM,NY,17,Open seat,House,New York,Democrat,"JONES, MONDAIRE Democrat New York House","JONES, MONDAIRE Democrat New York House 2021"
2077,H0NY17190,"BUCHWALD, DAVID",DEM,NY,17,Open seat,House,New York,Democrat,"BUCHWALD, DAVID Democrat New York House","BUCHWALD, DAVID Democrat New York House 2021"
2078,H0NY17224,"CARLUCCI, DAVID",DEM,NY,17,Open seat,House,New York,Democrat,"CARLUCCI, DAVID Democrat New York House","CARLUCCI, DAVID Democrat New York House 2021"
2079,H0NY17240,"FINE, ALLISON HARRIS MS.",DEM,NY,17,Open seat,House,New York,Democrat,"FINE, ALLISON HARRIS MS. Democrat New York House","FINE, ALLISON HARRIS MS. Democrat New York House 2021"
2080,H0NY17257,"HERNANDEZ, ASHA CASTLEBERRY",DEM,NY,17,Open seat,House,New York,Democrat,"HERNANDEZ, ASHA CASTLEBERRY Democrat New York House","HERNANDEZ, ASHA CASTLEBERRY Democrat New York House 2021"
2081,H0NY17265,"FARKAS, EVELYN",DEM,NY,17,Open seat,House,New York,Democrat,"FARKAS, EVELYN Democrat New York House","FARKAS, EVELYN Democrat New York House 2021"
2082,H0NY17273,"SCHLEIFER, ADAM",DEM,NY,17,Open seat,House,New York,Democrat,"SCHLEIFER, ADAM Democrat New York House","SCHLEIFER, ADAM Democrat New York House 2021"
2083,H0NY17281,"PARKER, CATHERINE F",DEM,NY,17,Open seat,House,New York,Democrat,"PARKER, CATHERINE F Democrat New York House","PARKER, CATHERINE F Democrat New York House 2021"
2084,H8NY20056,"LOWEY, NITA M",DEM,NY,17,Incumbent,House,New York,Democrat,"LOWEY, NITA M Democrat New York House","LOWEY, NITA M Democrat New York House 2021"
2085,H0NY17182,"BUCHANAN, JARRED MR.",REP,NY,17,Open seat,House,New York,Republican,"BUCHANAN, JARRED MR. Republican New York House","BUCHANAN, JARRED MR. Republican New York House 2021"
2086,H0NY17307,"GOTTESFELD, YEHUDIS",REP,NY,17,Open seat,House,New York,Republican,"GOTTESFELD, YEHUDIS Republican New York House","GOTTESFELD, YEHUDIS Republican New York House 2021"
2087,H0NY17315,"MCARDLE SCHULMAN, MAUREEN B MRS",REP,NY,17,Open seat,House,New York,Republican,"MCARDLE SCHULMAN, MAUREEN B MRS Republican New York House","MCARDLE SCHULMAN, MAUREEN B MRS Republican New York House 2021"
2088,H0NY17208,"EISEN, JOSH",IND,NY,17,Open seat,House,New York,Independent,"EISEN, JOSH Independent New York House","EISEN, JOSH Independent New York House 2021"
2089,H8NY17110,"CIARDULLO, JOSEPH JOHN",REF,NY,17,Challenger,House,New York,Other,"CIARDULLO, JOSEPH JOHN Other New York House","CIARDULLO, JOSEPH JOHN Other New York House 2021"
2090,H0NY17349,"PARIETTI, MIKE I.",SAM,NY,17,Challenger,House,New York,Other,"PARIETTI, MIKE I. Other New York House","PARIETTI, MIKE I. Other New York House 2021"
2091,H2NY18012,"BETANCOURT, ISMAEL JR.",DEM,NY,18,,House,New York,Democrat,"BETANCOURT, ISMAEL JR. Democrat New York House","BETANCOURT, ISMAEL JR. Democrat New York House 2021"
2092,H2NY22139,"MALONEY, SEAN PATRICK",DEM,NY,18,Incumbent,House,New York,Democrat,"MALONEY, SEAN PATRICK Democrat New York House","MALONEY, SEAN PATRICK Democrat New York House 2021"
2093,H0NY18172,"FARLEY, CHELE CHIAVACCI",REP,NY,18,Challenger,House,New York,Republican,"FARLEY, CHELE CHIAVACCI Republican New York House","FARLEY, CHELE CHIAVACCI Republican New York House 2021"
2094,H6NY18161,"BROWN, SAKIMA",REP,NY,18,Challenger,House,New York,Republican,"BROWN, SAKIMA Republican New York House","BROWN, SAKIMA Republican New York House 2021"
2095,H6NY18179,"CASTRICONE, DAN",REP,NY,18,Challenger,House,New York,Republican,"CASTRICONE, DAN Republican New York House","CASTRICONE, DAN Republican New York House 2021"
2096,H6NY18203,"OLIVA JR, PHIL",REP,NY,18,Challenger,House,New York,Republican,"OLIVA JR, PHIL Republican New York House","OLIVA JR, PHIL Republican New York House 2021"
2097,H8NY18266,"BUCHANAN, JARRED ROBERT MR.",REP,NY,18,Challenger,House,New York,Republican,"BUCHANAN, JARRED ROBERT MR. Republican New York House","BUCHANAN, JARRED ROBERT MR. Republican New York House 2021"
2098,H8NY18274,"O'DONNELL, JAMES D",REP,NY,18,Challenger,House,New York,Republican,"O'DONNELL, JAMES D Republican New York House","O'DONNELL, JAMES D Republican New York House 2021"
2099,H4NY18109,"SMITH, SCOTT A",UNK,NY,18,Challenger,House,New York,Other,"SMITH, SCOTT A Other New York House","SMITH, SCOTT A Other New York House 2021"
2100,H8NY19173,"FLYNN, BRIAN",DEM,NY,19,Challenger,House,New York,Democrat,"FLYNN, BRIAN Democrat New York House","FLYNN, BRIAN Democrat New York House 2021"
2101,H8NY19181,"DELGADO, ANTONIO",DEM,NY,19,Incumbent,House,New York,Democrat,"DELGADO, ANTONIO Democrat New York House","DELGADO, ANTONIO Democrat New York House 2021"
2102,H8NY19215,"BEALS, JEFFREY",DEM,NY,19,Challenger,House,New York,Democrat,"BEALS, JEFFREY Democrat New York House","BEALS, JEFFREY Democrat New York House 2021"
2103,H8NY19223,"RYAN, PATRICK",DEM,NY,19,Challenger,House,New York,Democrat,"RYAN, PATRICK Democrat New York House","RYAN, PATRICK Democrat New York House 2021"
2104,H0NY19188,"HAWATMEH, OLA",REP,NY,19,Challenger,House,New York,Republican,"HAWATMEH, OLA Republican New York House","HAWATMEH, OLA Republican New York House 2021"
2105,H0NY19196,"GERMAN, ANTHONY",REP,NY,19,Challenger,House,New York,Republican,"GERMAN, ANTHONY Republican New York House","GERMAN, ANTHONY Republican New York House 2021"
2106,H0NY19204,"VAN DE WATER, KYLE",REP,NY,19,Challenger,House,New York,Republican,"VAN DE WATER, KYLE Republican New York House","VAN DE WATER, KYLE Republican New York House 2021"
2107,H6NY19169,"FASO, JOHN J. MR.",REP,NY,19,Incumbent,House,New York,Republican,"FASO, JOHN J. MR. Republican New York House","FASO, JOHN J. MR. Republican New York House 2021"
2108,H6NY19193,"HEANEY, ANDREW",REP,NY,19,Open seat,House,New York,Republican,"HEANEY, ANDREW Republican New York House","HEANEY, ANDREW Republican New York House 2021"
2109,H6NY19227,"BISHOP, BOB",REP,NY,19,Open seat,House,New York,Republican,"BISHOP, BOB Republican New York House","BISHOP, BOB Republican New York House 2021"
2110,H8NY19249,"NEAL, DIANE",NPA,NY,19,Challenger,House,New York,Other,"NEAL, DIANE Other New York House","NEAL, DIANE Other New York House 2021"
2111,H0NY20079,"MURPHY, SCOTT M",DEM,NY,20,Incumbent,House,New York,Democrat,"MURPHY, SCOTT M Democrat New York House","MURPHY, SCOTT M Democrat New York House 2021"
2112,H8NY20080,"FEINER, PAUL J",DEM,NY,20,Challenger,House,New York,Democrat,"FEINER, PAUL J Democrat New York House","FEINER, PAUL J Democrat New York House 2021"
2113,H8NY21203,"TONKO, PAUL DAVID",DEM,NY,20,Incumbent,House,New York,Democrat,"TONKO, PAUL DAVID Democrat New York House","TONKO, PAUL DAVID Democrat New York House 2021"
2114,H0NY20111,"JOY, ELIZABETH L",REP,NY,20,Challenger,House,New York,Republican,"JOY, ELIZABETH L Republican New York House","JOY, ELIZABETH L Republican New York House 2021"
2115,H0NY20129,"SENEY, MICHAEL ROBERT",REP,NY,20,Challenger,House,New York,Republican,"SENEY, MICHAEL ROBERT Republican New York House","SENEY, MICHAEL ROBERT Republican New York House 2021"
2116,H0NY23081,"OWENS, WILLIAM",DEM,NY,21,Challenger,House,New York,Democrat,"OWENS, WILLIAM Democrat New York House","OWENS, WILLIAM Democrat New York House 2021"
2117,H2NY21115,"NELSON, PATRICK F",DEM,NY,21,Challenger,House,New York,Democrat,"NELSON, PATRICK F Democrat New York House","NELSON, PATRICK F Democrat New York House 2021"
2118,H8NY21245,"COBB, TEDRA",DEM,NY,21,Challenger,House,New York,Democrat,"COBB, TEDRA Democrat New York House","COBB, TEDRA Democrat New York House 2021"
2119,H8NY21252,"WILSON, KATIE",DEM,NY,21,Challenger,House,New York,Democrat,"WILSON, KATIE Democrat New York House","WILSON, KATIE Democrat New York House 2021"
2120,H8NY21260,"MARTZ, EMILY",DEM,NY,21,Challenger,House,New York,Democrat,"MARTZ, EMILY Democrat New York House","MARTZ, EMILY Democrat New York House 2021"
2121,H8NY21328,"IDLEMAN, SARA",DEM,NY,21,Challenger,House,New York,Democrat,"IDLEMAN, SARA Democrat New York House","IDLEMAN, SARA Democrat New York House 2021"
2122,H8NY21336,"MASTRIANNI, DAVID",DEM,NY,21,Challenger,House,New York,Democrat,"MASTRIANNI, DAVID Democrat New York House","MASTRIANNI, DAVID Democrat New York House 2021"
2123,H0NY23057,"DOHENY, MATTHEW A",REP,NY,21,Open seat,House,New York,Republican,"DOHENY, MATTHEW A Republican New York House","DOHENY, MATTHEW A Republican New York House 2021"
2124,H4NY21079,"STEFANIK, ELISE M.",REP,NY,21,Incumbent,House,New York,Republican,"STEFANIK, ELISE M. Republican New York House","STEFANIK, ELISE M. Republican New York House 2021"
2125,H8NY21351,"KAHN, LYNN SANDRA",GRE,NY,21,Challenger,House,New York,Green,"KAHN, LYNN SANDRA Green New York House","KAHN, LYNN SANDRA Green New York House 2021"
2126,H8NY22151,"BRINDISI, ANTHONY",DEM,NY,22,Incumbent,House,New York,Democrat,"BRINDISI, ANTHONY Democrat New York House","BRINDISI, ANTHONY Democrat New York House 2021"
2127,H0NY22075,"SAGER, FRANKLIN WALTON MR.",REP,NY,22,Challenger,House,New York,Republican,"SAGER, FRANKLIN WALTON MR. Republican New York House","SAGER, FRANKLIN WALTON MR. Republican New York House 2021"
2128,H0NY22083,"CORNWELL, STEPHEN",REP,NY,22,Challenger,House,New York,Republican,"CORNWELL, STEPHEN Republican New York House","CORNWELL, STEPHEN Republican New York House 2021"
2129,H4NY22051,"TENNEY, CLAUDIA",REP,NY,22,Challenger,House,New York,Republican,"TENNEY, CLAUDIA Republican New York House","TENNEY, CLAUDIA Republican New York House 2021"
2130,H6NY22098,"PHILLIPS, GEORGE KARL MR",REP,NY,22,Challenger,House,New York,Republican,"PHILLIPS, GEORGE KARL MR Republican New York House","PHILLIPS, GEORGE KARL MR Republican New York House 2021"
2131,H6NY22114,"WELLS, STEVEN M",REP,NY,22,Open seat,House,New York,Republican,"WELLS, STEVEN M Republican New York House","WELLS, STEVEN M Republican New York House 2021"
2132,H0NY23123,"NOREN, SCOTT A",DEM,NY,23,Challenger,House,New York,Democrat,"NOREN, SCOTT A Democrat New York House","NOREN, SCOTT A Democrat New York House 2021"
2133,H8NY23134,"SUNDQUIST, EDWARD A.",DEM,NY,23,Challenger,House,New York,Democrat,"SUNDQUIST, EDWARD A. Democrat New York House","SUNDQUIST, EDWARD A. Democrat New York House 2021"
2134,H8NY23167,"GOLDEN, IAN",DEM,NY,23,Challenger,House,New York,Democrat,"GOLDEN, IAN Democrat New York House","GOLDEN, IAN Democrat New York House 2021"
2135,H8NY23183,"MITRANO, TRACY",DEM,NY,23,Challenger,House,New York,Democrat,"MITRANO, TRACY Democrat New York House","MITRANO, TRACY Democrat New York House 2021"
2136,H0NY23107,"HOFFMAN, DOUGLAS L. MR.",REP,NY,23,Challenger,House,New York,Republican,"HOFFMAN, DOUGLAS L. MR. Republican New York House","HOFFMAN, DOUGLAS L. MR. Republican New York House 2021"
2137,H0NY29054,"REED, THOMAS W",REP,NY,23,Incumbent,House,New York,Republican,"REED, THOMAS W Republican New York House","REED, THOMAS W Republican New York House 2021"
2138,H0NY24055,"MISSO, ROGER",DEM,NY,24,Challenger,House,New York,Democrat,"MISSO, ROGER Democrat New York House","MISSO, ROGER Democrat New York House 2021"
2139,H0NY24063,"CONOLE, FRANCIS",DEM,NY,24,Challenger,House,New York,Democrat,"CONOLE, FRANCIS Democrat New York House","CONOLE, FRANCIS Democrat New York House 2021"
2140,H8NY24090,"BALTER, DANA",DEM,NY,24,Challenger,House,New York,Democrat,"BALTER, DANA Democrat New York House","BALTER, DANA Democrat New York House 2021"
2141,H4NY24073,"KATKO, JOHN M",REP,NY,24,Incumbent,House,New York,Republican,"KATKO, JOHN M Republican New York House","KATKO, JOHN M Republican New York House 2021"
2142,H8NY24116,"BASS, WILLIAM HENRY MR. JR",NPA,NY,24,Challenger,House,New York,Other,"BASS, WILLIAM HENRY MR. JR Other New York House","BASS, WILLIAM HENRY MR. JR Other New York House 2021"
2143,H6NY03031,"SLAUGHTER, LOUISE",DEM,NY,25,Incumbent,House,New York,Democrat,"SLAUGHTER, LOUISE Democrat New York House","SLAUGHTER, LOUISE Democrat New York House 2021"
2144,H8NY25105,"MORELLE, JOSEPH D",DEM,NY,25,Incumbent,House,New York,Democrat,"MORELLE, JOSEPH D Democrat New York House","MORELLE, JOSEPH D Democrat New York House 2021"
2145,H8NY25113,"WILT, ROBIN",DEM,NY,25,Challenger,House,New York,Democrat,"WILT, ROBIN Democrat New York House","WILT, ROBIN Democrat New York House 2021"
2146,H0NY25094,"MITRIS, GEORGE MR.",REP,NY,25,Challenger,House,New York,Republican,"MITRIS, GEORGE MR. Republican New York House","MITRIS, GEORGE MR. Republican New York House 2021"
2147,H4NY29098,"ASSINI, MARK W",REP,NY,25,Challenger,House,New York,Republican,"ASSINI, MARK W Republican New York House","ASSINI, MARK W Republican New York House 2021"
2148,H0NY25102,"WILSON, KEVIN A",LIB,NY,25,Challenger,House,New York,Libertarian,"WILSON, KEVIN A Libertarian New York House","WILSON, KEVIN A Libertarian New York House 2021"
2149,H0NY26068,"EGRIU, EMIN",DEM,NY,26,Challenger,House,New York,Democrat,"EGRIU, EMIN Democrat New York House","EGRIU, EMIN Democrat New York House 2021"
2150,H0NY28114,"EGRIU, EMIN EDDIE",DEM,NY,26,Challenger,House,New York,Democrat,"EGRIU, EMIN EDDIE Democrat New York House","EGRIU, EMIN EDDIE Democrat New York House 2021"
2151,H4NY27076,"HIGGINS, BRIAN",DEM,NY,26,Incumbent,House,New York,Democrat,"HIGGINS, BRIAN Democrat New York House","HIGGINS, BRIAN Democrat New York House 2021"
2152,H8NY27176,"MCMURRAY, NATHAN",DEM,NY,27,Challenger,House,New York,Democrat,"MCMURRAY, NATHAN Democrat New York House","MCMURRAY, NATHAN Democrat New York House 2021"
2153,H0NY27090,"JACOBS, CHRISTOPHER L.",REP,NY,27,Incumbent,House,New York,Republican,"JACOBS, CHRISTOPHER L. Republican New York House","JACOBS, CHRISTOPHER L. Republican New York House 2021"
2154,H0NY27116,"ORTT, ROBERT G",REP,NY,27,Challenger,House,New York,Republican,"ORTT, ROBERT G Republican New York House","ORTT, ROBERT G Republican New York House 2021"
2155,H0NY27132,"MYCHAJLIW, STEFAN IWAN JR.",REP,NY,27,Challenger,House,New York,Republican,"MYCHAJLIW, STEFAN IWAN JR. Republican New York House","MYCHAJLIW, STEFAN IWAN JR. Republican New York House 2021"
2156,H8NY26087,"BELLAVIA, DAVID GREGORY",REP,NY,27,Challenger,House,New York,Republican,"BELLAVIA, DAVID GREGORY Republican New York House","BELLAVIA, DAVID GREGORY Republican New York House 2021"
2157,H8NY29032,"COLLINS, CHRISTOPHER C",REP,NY,27,Incumbent,House,New York,Republican,"COLLINS, CHRISTOPHER C Republican New York House","COLLINS, CHRISTOPHER C Republican New York House 2021"
2158,H0NY27108,"PARLATO, BETH",CRV,NY,27,Challenger,House,New York,Other,"PARLATO, BETH Other New York House","PARLATO, BETH Other New York House 2021"
2159,H0NY27082,"WHITMER, DUANE JAMES",LIB,NY,27,Challenger,House,New York,Libertarian,"WHITMER, DUANE JAMES Libertarian New York House","WHITMER, DUANE JAMES Libertarian New York House 2021"
2160,H6NY29168,"MASSA, ERIC JJ",DEM,NY,29,Incumbent,House,New York,Democrat,"MASSA, ERIC JJ Democrat New York House","MASSA, ERIC JJ Democrat New York House 2021"
2161,H6NY36015,"LAFALCE, JOHN J",DEM,NY,29,Challenger,House,New York,Democrat,"LAFALCE, JOHN J Democrat New York House","LAFALCE, JOHN J Democrat New York House 2021"
2162,H4NY29106,"KOLB, BRIAN M",REP,NY,29,Challenger,House,New York,Republican,"KOLB, BRIAN M Republican New York House","KOLB, BRIAN M Republican New York House 2021"
2163,H0OH01081,"FOSTER, NIKKI",DEM,OH,1,Challenger,House,Ohio,Democrat,"FOSTER, NIKKI Democrat Ohio House","FOSTER, NIKKI Democrat Ohio House 2021"
2164,H0OH01099,"SCHRODER, KATE",DEM,OH,1,Challenger,House,Ohio,Democrat,"SCHRODER, KATE Democrat Ohio House","SCHRODER, KATE Democrat Ohio House 2021"
2165,H2OH02093,"KUNDRATA, FREDERICK LOUIS III",DEM,OH,1,Challenger,House,Ohio,Democrat,"KUNDRATA, FREDERICK LOUIS III Democrat Ohio House","KUNDRATA, FREDERICK LOUIS III Democrat Ohio House 2021"
2166,H8OH01084,"WEAVER, LAURA ANN",DEM,OH,1,Challenger,House,Ohio,Democrat,"WEAVER, LAURA ANN Democrat Ohio House","WEAVER, LAURA ANN Democrat Ohio House 2021"
2167,H8OH01118,"PUREVAL, AFTAB",DEM,OH,1,Challenger,House,Ohio,Democrat,"PUREVAL, AFTAB Democrat Ohio House","PUREVAL, AFTAB Democrat Ohio House 2021"
2168,H8OH01043,"CHABOT, STEVE",REP,OH,1,Incumbent,House,Ohio,Republican,"CHABOT, STEVE Republican Ohio House","CHABOT, STEVE Republican Ohio House 2021"
2169,H0OH01115,"KAHN, KEVIN",LIB,OH,1,Challenger,House,Ohio,Libertarian,"KAHN, KEVIN Libertarian Ohio House","KAHN, KEVIN Libertarian Ohio House 2021"
2170,H6OH09073,"KUBALA, DIRK",LIB,OH,1,Challenger,House,Ohio,Libertarian,"KUBALA, DIRK Libertarian Ohio House","KUBALA, DIRK Libertarian Ohio House 2021"
2171,H0OH02139,"CASTLE, JAIME",DEM,OH,2,Challenger,House,Ohio,Democrat,"CASTLE, JAIME Democrat Ohio House","CASTLE, JAIME Democrat Ohio House 2021"
2172,H4OH02156,"TYSZKIEWICZ, MAREK",DEM,OH,2,Challenger,House,Ohio,Democrat,"TYSZKIEWICZ, MAREK Democrat Ohio House","TYSZKIEWICZ, MAREK Democrat Ohio House 2021"
2173,H8OH02124,"SCHILLER, JILL",DEM,OH,2,Challenger,House,Ohio,Democrat,"SCHILLER, JILL Democrat Ohio House","SCHILLER, JILL Democrat Ohio House 2021"
2174,H2OH02085,"WENSTRUP, BRAD DR.",REP,OH,2,Incumbent,House,Ohio,Republican,"WENSTRUP, BRAD DR. Republican Ohio House","WENSTRUP, BRAD DR. Republican Ohio House 2021"
2175,H6OH02102,"BRINKMAN, THOMAS E",REP,OH,2,Challenger,House,Ohio,Republican,"BRINKMAN, THOMAS E Republican Ohio House","BRINKMAN, THOMAS E Republican Ohio House 2021"
2176,H0OH03103,"HARPER, MORGAN",DEM,OH,3,Challenger,House,Ohio,Democrat,"HARPER, MORGAN Democrat Ohio House","HARPER, MORGAN Democrat Ohio House 2021"
2177,H2OH03125,"BEATTY, JOYCE",DEM,OH,3,Incumbent,House,Ohio,Democrat,"BEATTY, JOYCE Democrat Ohio House","BEATTY, JOYCE Democrat Ohio House 2021"
2178,H2OH03141,"LONG, CHRIS",REP,OH,3,Challenger,House,Ohio,Republican,"LONG, CHRIS Republican Ohio House","LONG, CHRIS Republican Ohio House 2021"
2179,H4OH03089,"VENNON, ERIC T",REP,OH,3,Challenger,House,Ohio,Republican,"VENNON, ERIC T Republican Ohio House","VENNON, ERIC T Republican Ohio House 2021"
2180,H0OH03129,"MOSS, NICHOLAS D",OTH,OH,3,Challenger,House,Ohio,Other,"MOSS, NICHOLAS D Other Ohio House","MOSS, NICHOLAS D Other Ohio House 2021"
2181,H0OH04101,"LARSEN, MIKE",DEM,OH,4,Challenger,House,Ohio,Democrat,"LARSEN, MIKE Democrat Ohio House","LARSEN, MIKE Democrat Ohio House 2021"
2182,H4OH04046,"GARRETT, JANET PATRICIA MRS.",DEM,OH,4,Challenger,House,Ohio,Democrat,"GARRETT, JANET PATRICIA MRS. Democrat Ohio House","GARRETT, JANET PATRICIA MRS. Democrat Ohio House 2021"
2183,H6OH04082,"JORDAN, JAMES D.",REP,OH,4,Incumbent,House,Ohio,Republican,"JORDAN, JAMES D. Republican Ohio House","JORDAN, JAMES D. Republican Ohio House 2021"
2184,H0OH04119,"GIBBS, CHRIS",IND,OH,4,Challenger,House,Ohio,Independent,"GIBBS, CHRIS Independent Ohio House","GIBBS, CHRIS Independent Ohio House 2021"
2185,H0OH05074,"RUBANDO, NICK",DEM,OH,5,Challenger,House,Ohio,Democrat,"RUBANDO, NICK Democrat Ohio House","RUBANDO, NICK Democrat Ohio House 2021"
2186,H0OH05082,"CARRIGAN, MICHAEL XAVIER",DEM,OH,5,Challenger,House,Ohio,Democrat,"CARRIGAN, MICHAEL XAVIER Democrat Ohio House","CARRIGAN, MICHAEL XAVIER Democrat Ohio House 2021"
2187,H8OH05036,"LATTA, ROBERT EDWARD",REP,OH,5,Incumbent,House,Ohio,Republican,"LATTA, ROBERT EDWARD Republican Ohio House","LATTA, ROBERT EDWARD Republican Ohio House 2021"
2188,H8OH06133,"ROBERTS, SHAWNA",DEM,OH,6,Challenger,House,Ohio,Democrat,"ROBERTS, SHAWNA Democrat Ohio House","ROBERTS, SHAWNA Democrat Ohio House 2021"
